,artikelnr:,text:,jci1.0:,jci1.3:,versie:
0,/Hoofdstuk1/Artikel1,"Allen die zich in Nederland bevinden, worden in gelijke gevallen gelijk behandeld. Discriminatie wegens godsdienst, levensovertuiging, politieke gezindheid, ras, geslacht of op welke grond dan ook, is niet toegestaan.",1.0:c:BWBR0001840&artikel=1&g=2018-12-21,jci1.3:c:BWBR0001840&hoofdstuk=1&artikel=1&z=2018-12-21&g=2018-12-21,21-12-2018
1,/Hoofdstuk1/Artikel2," $ Lid1 :  $  De wet regelt wie Nederlander is.  $ Lid2 :  $  De wet regelt de toelating en de uitzetting van vreemdelingen.  $ Lid3 :  $  Uitlevering kan slechts geschieden krachtens verdrag. Verdere voorschriften omtrent uitlevering worden bij de wet gegeven.  $ Lid4 :  $  Ieder heeft het recht het land te verlaten, behoudens in de gevallen, bij de wet bepaald.",1.0:c:BWBR0001840&artikel=2&g=2018-12-21,jci1.3:c:BWBR0001840&hoofdstuk=1&artikel=2&z=2018-12-21&g=2018-12-21,21-12-2018
2,/Hoofdstuk1/Artikel3,Alle Nederlanders zijn op gelijke voet in openbare dienst benoembaar.,1.0:c:BWBR0001840&artikel=3&g=2018-12-21,jci1.3:c:BWBR0001840&hoofdstuk=1&artikel=3&z=2018-12-21&g=2018-12-21,21-12-2018
3,/Hoofdstuk1/Artikel4,"Iedere Nederlander heeft gelijkelijk recht de leden van algemeen vertegenwoordigende organen te verkiezen alsmede tot lid van deze organen te worden verkozen, behoudens bij de wet gestelde beperkingen en uitzonderingen.",1.0:c:BWBR0001840&artikel=4&g=2018-12-21,jci1.3:c:BWBR0001840&hoofdstuk=1&artikel=4&z=2018-12-21&g=2018-12-21,21-12-2018
4,/Hoofdstuk1/Artikel5,Ieder heeft het recht verzoeken schriftelijk bij het bevoegd gezag in te dienen.,1.0:c:BWBR0001840&artikel=5&g=2018-12-21,jci1.3:c:BWBR0001840&hoofdstuk=1&artikel=5&z=2018-12-21&g=2018-12-21,21-12-2018
5,/Hoofdstuk1/Artikel6," $ Lid1 :  $  Ieder heeft het recht zijn godsdienst of levensovertuiging, individueel of in gemeenschap met anderen, vrij te belijden, behoudens ieders verantwoordelijkheid volgens de wet.  $ Lid2 :  $  De wet kan ter zake van de uitoefening van dit recht buiten gebouwen en besloten plaatsen regels stellen ter bescherming van de gezondheid, in het belang van het verkeer en ter bestrijding of voorkoming van wanordelijkheden.",1.0:c:BWBR0001840&artikel=6&g=2018-12-21,jci1.3:c:BWBR0001840&hoofdstuk=1&artikel=6&z=2018-12-21&g=2018-12-21,21-12-2018
6,/Hoofdstuk1/Artikel7," $ Lid1 :  $  Niemand heeft voorafgaand verlof nodig om door de drukpers gedachten of gevoelens te openbaren, behoudens ieders verantwoordelijkheid volgens de wet.  $ Lid2 :  $  De wet stelt regels omtrent radio en televisie. Er is geen voorafgaand toezicht op de inhoud van een radio- of televisieuitzending.  $ Lid3 :  $  Voor het openbaren van gedachten of gevoelens door andere dan in de voorgaande leden genoemde middelen heeft niemand voorafgaand verlof nodig wegens de inhoud daarvan, behoudens ieders verantwoordelijkheid volgens de wet. De wet kan het geven van vertoningen toegankelijk voor personen jonger dan zestien jaar regelen ter bescherming van de goede zeden.  $ Lid4 :  $  De voorgaande leden zijn niet van toepassing op het maken van handelsreclame.",1.0:c:BWBR0001840&artikel=7&g=2018-12-21,jci1.3:c:BWBR0001840&hoofdstuk=1&artikel=7&z=2018-12-21&g=2018-12-21,21-12-2018
7,/Hoofdstuk1/Artikel8,Het recht tot vereniging wordt erkend. Bij de wet kan dit recht worden beperkt in het belang van de openbare orde.,1.0:c:BWBR0001840&artikel=8&g=2018-12-21,jci1.3:c:BWBR0001840&hoofdstuk=1&artikel=8&z=2018-12-21&g=2018-12-21,21-12-2018
8,/Hoofdstuk1/Artikel9," $ Lid1 :  $  Het recht tot vergadering en betoging wordt erkend, behoudens ieders verantwoordelijkheid volgens de wet.  $ Lid2 :  $  De wet kan regels stellen ter bescherming van de gezondheid, in het belang van het verkeer en ter bestrijding of voorkoming van wanordelijkheden.",1.0:c:BWBR0001840&artikel=9&g=2018-12-21,jci1.3:c:BWBR0001840&hoofdstuk=1&artikel=9&z=2018-12-21&g=2018-12-21,21-12-2018
9,/Hoofdstuk1/Artikel10," $ Lid1 :  $  Ieder heeft, behoudens bij of krachtens de wet te stellen beperkingen, recht op eerbiediging van zijn persoonlijke levenssfeer.  $ Lid2 :  $  De wet stelt regels ter bescherming van de persoonlijke levenssfeer in verband met het vastleggen en verstrekken van persoonsgegevens.  $ Lid3 :  $  De wet stelt regels inzake de aanspraken van personen op kennisneming van over hen vastgelegde gegevens en van het gebruik dat daarvan wordt gemaakt, alsmede op verbetering van zodanige gegevens.",1.0:c:BWBR0001840&artikel=10&g=2018-12-21,jci1.3:c:BWBR0001840&hoofdstuk=1&artikel=10&z=2018-12-21&g=2018-12-21,21-12-2018
10,/Hoofdstuk1/Artikel11,"Ieder heeft, behoudens bij of krachtens de wet te stellen beperkingen, recht op onaantastbaarheid van zijn lichaam.",1.0:c:BWBR0001840&artikel=11&g=2018-12-21,jci1.3:c:BWBR0001840&hoofdstuk=1&artikel=11&z=2018-12-21&g=2018-12-21,21-12-2018
11,/Hoofdstuk1/Artikel12," $ Lid1 :  $  Het binnentreden in een woning zonder toestemming van de bewoner is alleen geoorloofd in de gevallen bij of krachtens de wet bepaald, door hen die daartoe bij of krachtens de wet zijn aangewezen.  $ Lid2 :  $  Voor het binnentreden overeenkomstig het eerste lid zijn voorafgaande legitimatie en mededeling van het doel van het binnentreden vereist, behoudens bij de wet gestelde uitzonderingen.  $ Lid3 :  $  Aan de bewoner wordt zo spoedig mogelijk een schriftelijk verslag van het binnentreden verstrekt. Indien het binnentreden in het belang van de nationale veiligheid of dat van de strafvordering heeft plaatsgevonden, kan volgens bij de wet te stellen regels de verstrekking van het verslag worden uitgesteld. In de bij de wet te bepalen gevallen kan de verstrekking achterwege worden gelaten, indien het belang van de nationale veiligheid zich tegen verstrekking blijvend verzet.",1.0:c:BWBR0001840&artikel=12&g=2018-12-21,jci1.3:c:BWBR0001840&hoofdstuk=1&artikel=12&z=2018-12-21&g=2018-12-21,21-12-2018
12,/Hoofdstuk1/Artikel13," $ Lid1 :  $  Het briefgeheim is onschendbaar, behalve, in de gevallen bij de wet bepaald, op last van de rechter.  $ Lid2 :  $  Het telefoon- en telegraafgeheim is onschendbaar, behalve, in de gevallen bij de wet bepaald, door of met machtiging van hen die daartoe bij de wet zijn aangewezen.",1.0:c:BWBR0001840&artikel=13&g=2018-12-21,jci1.3:c:BWBR0001840&hoofdstuk=1&artikel=13&z=2018-12-21&g=2018-12-21,21-12-2018
13,/Hoofdstuk1/Artikel14," $ Lid1 :  $  Onteigening kan alleen geschieden in het algemeen belang en tegen vooraf verzekerde schadeloosstelling, een en ander naar bij of krachtens de wet te stellen voorschriften.  $ Lid2 :  $  De schadeloosstelling behoeft niet vooraf verzekerd te zijn, wanneer in geval van nood onverwijld onteigening geboden is.  $ Lid3 :  $  In de gevallen bij of krachtens de wet bepaald bestaat recht op schadeloosstelling of tegemoetkoming in de schade, indien in het algemeen belang eigendom door het bevoegd gezag wordt vernietigd of onbruikbaar gemaakt of de uitoefening van het eigendomsrecht wordt beperkt.",1.0:c:BWBR0001840&artikel=14&g=2018-12-21,jci1.3:c:BWBR0001840&hoofdstuk=1&artikel=14&z=2018-12-21&g=2018-12-21,21-12-2018
14,/Hoofdstuk1/Artikel15," $ Lid1 :  $  Buiten de gevallen bij of krachtens de wet bepaald mag niemand zijn vrijheid worden ontnomen.  $ Lid2 :  $  Hij aan wie anders dan op rechterlijk bevel zijn vrijheid is ontnomen, kan aan de rechter zijn invrijheidstelling verzoeken. Hij wordt in dat geval door de rechter gehoord binnen een bij de wet te bepalen termijn. De rechter gelast de onmiddellijke invrijheidstelling, indien hij de vrijheidsontneming onrechtmatig oordeelt.  $ Lid3 :  $  De berechting van hem aan wie met het oog daarop zijn vrijheid is ontnomen, vindt binnen een redelijke termijn plaats.  $ Lid4 :  $  Hij aan wie rechtmatig zijn vrijheid is ontnomen, kan worden beperkt in de uitoefening van grondrechten voor zover deze zich niet met de vrijheidsontneming verdraagt.",1.0:c:BWBR0001840&artikel=15&g=2018-12-21,jci1.3:c:BWBR0001840&hoofdstuk=1&artikel=15&z=2018-12-21&g=2018-12-21,21-12-2018
15,/Hoofdstuk1/Artikel16,Geen feit is strafbaar dan uit kracht van een daaraan voorafgegane wettelijke strafbepaling.,1.0:c:BWBR0001840&artikel=16&g=2018-12-21,jci1.3:c:BWBR0001840&hoofdstuk=1&artikel=16&z=2018-12-21&g=2018-12-21,21-12-2018
16,/Hoofdstuk1/Artikel17,Niemand kan tegen zijn wil worden afgehouden van de rechter die de wet hem toekent.,1.0:c:BWBR0001840&artikel=17&g=2018-12-21,jci1.3:c:BWBR0001840&hoofdstuk=1&artikel=17&z=2018-12-21&g=2018-12-21,21-12-2018
17,/Hoofdstuk1/Artikel18, $ Lid1 :  $  Ieder kan zich in rechte en in administratief beroep doen bijstaan.  $ Lid2 :  $  De wet stelt regels omtrent het verlenen van rechtsbijstand aan minder draagkrachtigen.,1.0:c:BWBR0001840&artikel=18&g=2018-12-21,jci1.3:c:BWBR0001840&hoofdstuk=1&artikel=18&z=2018-12-21&g=2018-12-21,21-12-2018
18,/Hoofdstuk1/Artikel19," $ Lid1 :  $  Bevordering van voldoende werkgelegenheid is voorwerp van zorg der overheid.  $ Lid2 :  $  De wet stelt regels omtrent de rechtspositie van hen die arbeid verrichten en omtrent hun bescherming daarbij, alsmede omtrent medezeggenschap.  $ Lid3 :  $  Het recht van iedere Nederlander op vrije keuze van arbeid wordt erkend, behoudens de beperkingen bij of krachtens de wet gesteld.",1.0:c:BWBR0001840&artikel=19&g=2018-12-21,jci1.3:c:BWBR0001840&hoofdstuk=1&artikel=19&z=2018-12-21&g=2018-12-21,21-12-2018
19,/Hoofdstuk1/Artikel20," $ Lid1 :  $  De bestaanszekerheid der bevolking en spreiding van welvaart zijn voorwerp van zorg der overheid.  $ Lid2 :  $  De wet stelt regels omtrent de aanspraken op sociale zekerheid.  $ Lid3 :  $  Nederlanders hier te lande, die niet in het bestaan kunnen voorzien, hebben een bij de wet te regelen recht op bijstand van overheidswege.",1.0:c:BWBR0001840&artikel=20&g=2018-12-21,jci1.3:c:BWBR0001840&hoofdstuk=1&artikel=20&z=2018-12-21&g=2018-12-21,21-12-2018
20,/Hoofdstuk1/Artikel21,De zorg van de overheid is gericht op de bewoonbaarheid van het land en de bescherming en verbetering van het leefmilieu.,1.0:c:BWBR0001840&artikel=21&g=2018-12-21,jci1.3:c:BWBR0001840&hoofdstuk=1&artikel=21&z=2018-12-21&g=2018-12-21,21-12-2018
21,/Hoofdstuk1/Artikel22, $ Lid1 :  $  De overheid treft maatregelen ter bevordering van de volksgezondheid.  $ Lid2 :  $  Bevordering van voldoende woongelegenheid is voorwerp van zorg der overheid.  $ Lid3 :  $  Zij schept voorwaarden voor maatschappelijke en culturele ontplooiing en voor vrijetijdsbesteding.,1.0:c:BWBR0001840&artikel=22&g=2018-12-21,jci1.3:c:BWBR0001840&hoofdstuk=1&artikel=22&z=2018-12-21&g=2018-12-21,21-12-2018
22,/Hoofdstuk1/Artikel23," $ Lid1 :  $  Het onderwijs is een voorwerp van de aanhoudende zorg der regering.  $ Lid2 :  $  Het geven van onderwijs is vrij, behoudens het toezicht van de overheid en, voor wat bij de wet aangewezen vormen van onderwijs betreft, het onderzoek naar de bekwaamheid en de zedelijkheid van hen die onderwijs geven, een en ander bij de wet te regelen.  $ Lid3 :  $  Het openbaar onderwijs wordt, met eerbiediging van ieders godsdienst of levensovertuiging, bij de wet geregeld.  $ Lid4 :  $  In elke gemeente en in elk van de openbare lichamen, bedoeld in , wordt van overheidswege voldoend openbaar algemeen vormend lager onderwijs gegeven in een genoegzaam aantal openbare scholen. Volgens bij de wet te stellen regels kan afwijking van deze bepaling worden toegelaten, mits tot het ontvangen van zodanig onderwijs gelegenheid wordt gegeven, al dan niet in een openbare school.artikel 132a In elke gemeente en in elk van de openbare lichamen, bedoeld in , wordt van overheidswege voldoend openbaar algemeen vormend lager onderwijs gegeven in een genoegzaam aantal openbare scholen. Volgens bij de wet te stellen regels kan afwijking van deze bepaling worden toegelaten, mits tot het ontvangen van zodanig onderwijs gelegenheid wordt gegeven, al dan niet in een openbare school.  $ Lid5 :  $  De eisen van deugdelijkheid, aan het geheel of ten dele uit de openbare kas te bekostigen onderwijs te stellen, worden bij de wet geregeld, met inachtneming, voor zover het bijzonder onderwijs betreft, van de vrijheid van richting.  $ Lid6 :  $  Deze eisen worden voor het algemeen vormend lager onderwijs zodanig geregeld, dat de deugdelijkheid van het geheel uit de openbare kas bekostigd bijzonder onderwijs en van het openbaar onderwijs even afdoende wordt gewaarborgd. Bij die regeling wordt met name de vrijheid van het bijzonder onderwijs betreffende de keuze der leermiddelen en de aanstelling der onderwijzers geerbiedigd.  $ Lid7 :  $  Het bijzonder algemeen vormend lager onderwijs, dat aan de bij de wet te stellen voorwaarden voldoet, wordt naar dezelfde maatstaf als het openbaar onderwijs uit de openbare kas bekostigd. De wet stelt de voorwaarden vast, waarop voor het bijzonder algemeen vormend middelbaar en voorbereidend hoger onderwijs bijdragen uit de openbare kas worden verleend.  $ Lid8 :  $  De regering doet jaarlijks van de staat van het onderwijs verslag aan de Staten-Generaal.",1.0:c:BWBR0001840&artikel=23&g=2018-12-21,jci1.3:c:BWBR0001840&hoofdstuk=1&artikel=23&z=2018-12-21&g=2018-12-21,21-12-2018
23,/Hoofdstuk2/Paragraaf1/Artikel24,"Het koningschap wordt erfelijk vervuld door de wettige opvolgers van Koning Willem I, Prins van Oranje-Nassau.",1.0:c:BWBR0001840&artikel=24&g=2018-12-21,jci1.3:c:BWBR0001840&hoofdstuk=2&paragraaf=1&artikel=24&z=2018-12-21&g=2018-12-21,21-12-2018
24,/Hoofdstuk2/Paragraaf1/Artikel25,"Het koningschap gaat bij overlijden van de Koning krachtens erfopvolging over op zijn wettige nakomelingen, waarbij het oudste kind voorrang heeft, met plaatsvervulling volgens dezelfde regel. Bij gebreke van eigen nakomelingen gaat het koningschap op gelijke wijze over op de wettige nakomelingen eerst van zijn ouder, dan van zijn grootouder, in de lijn van erfopvolging, voor zover de overleden Koning niet verder bestaand dan in de derde graad van bloedverwantschap.",1.0:c:BWBR0001840&artikel=25&g=2018-12-21,jci1.3:c:BWBR0001840&hoofdstuk=2&paragraaf=1&artikel=25&z=2018-12-21&g=2018-12-21,21-12-2018
25,/Hoofdstuk2/Paragraaf1/Artikel26,"Het kind, waarvan een vrouw zwanger is op het ogenblik van het overlijden van de Koning, wordt voor de erfopvolging als reeds geboren aangemerkt. Komt het dood ter wereld, dan wordt het geacht nooit te hebben bestaan.",1.0:c:BWBR0001840&artikel=26&g=2018-12-21,jci1.3:c:BWBR0001840&hoofdstuk=2&paragraaf=1&artikel=26&z=2018-12-21&g=2018-12-21,21-12-2018
26,/Hoofdstuk2/Paragraaf1/Artikel27,Afstand van het koningschap leidt tot erfopvolging overeenkomstig de regels in de voorgaande artikelen gesteld. Na de afstand geboren kinderen en hun nakomelingen zijn van de erfopvolging uitgesloten.,1.0:c:BWBR0001840&artikel=27&g=2018-12-21,jci1.3:c:BWBR0001840&hoofdstuk=2&paragraaf=1&artikel=27&z=2018-12-21&g=2018-12-21,21-12-2018
27,/Hoofdstuk2/Paragraaf1/Artikel28," $ Lid1 :  $  De Koning, een huwelijk aangaande buiten bij de wet verleende toestemming, doet daardoor afstand van het koningschap.  $ Lid2 :  $  Gaat iemand die het koningschap van de Koning kan berven een zodanig huwelijk aan, dan is hij met de uit dit huwelijk geboren kinderen en hun nakomelingen van de erfopvolging uitgesloten.  $ Lid3 :  $  De Staten-Generaal beraadslagen en besluiten ter zake van een voorstel van wet, strekkende tot het verlenen van toestemming, in verenigde vergadering.",1.0:c:BWBR0001840&artikel=28&g=2018-12-21,jci1.3:c:BWBR0001840&hoofdstuk=2&paragraaf=1&artikel=28&z=2018-12-21&g=2018-12-21,21-12-2018
28,/Hoofdstuk2/Paragraaf1/Artikel29," $ Lid1 :  $  Wanneer uitzonderlijke omstandigheden daartoe nopen, kunnen bij een wet een of meer personen van de erfopvolging worden uitgesloten.  $ Lid2 :  $  Het voorstel daartoe wordt door of vanwege de Koning ingediend. De Staten-Generaal beraadslagen en besluiten ter zake in verenigde vergadering. Zij kunnen het voorstel alleen aannemen met ten minste twee derden van het aantal uitgebrachte stemmen.",1.0:c:BWBR0001840&artikel=29&g=2018-12-21,jci1.3:c:BWBR0001840&hoofdstuk=2&paragraaf=1&artikel=29&z=2018-12-21&g=2018-12-21,21-12-2018
29,/Hoofdstuk2/Paragraaf1/Artikel30," $ Lid1 :  $  Wanneer vooruitzicht bestaat dat een opvolger zal ontbreken, kan deze worden benoemd bij een wet. Het voorstel wordt door of vanwege de Koning ingediend. Na de indiening van het voorstel worden de kamers ontbonden. De nieuwe kamers beraadslagen en besluiten ter zake in verenigde vergadering. Zij kunnen het voorstel alleen aannemen met ten minste twee derden van het aantal uitgebrachte stemmen.  $ Lid2 :  $  Indien bij overlijden van de Koning of bij afstand van het koningschap een opvolger ontbreekt, worden de kamers ontbonden. De nieuwe kamers komen binnen vier maanden na het overlijden of de afstand in verenigde vergadering bijeen ten einde te besluiten omtrent de benoeming van een Koning. Zij kunnen een opvolger alleen benoemen met ten minste twee derden van het aantal uitgebrachte stemmen.",1.0:c:BWBR0001840&artikel=30&g=2018-12-21,jci1.3:c:BWBR0001840&hoofdstuk=2&paragraaf=1&artikel=30&z=2018-12-21&g=2018-12-21,21-12-2018
30,/Hoofdstuk2/Paragraaf1/Artikel31," $ Lid1 :  $  Een benoemde Koning kan krachtens erfopvolging alleen worden opgevolgd door zijn wettige nakomelingen.  $ Lid2 :  $  De bepalingen omtrent de erfopvolging en het eerste lid van dit artikel zijn van overeenkomstige toepassing op een benoemde opvolger, zolang deze nog geen Koning is.",1.0:c:BWBR0001840&artikel=31&g=2018-12-21,jci1.3:c:BWBR0001840&hoofdstuk=2&paragraaf=1&artikel=31&z=2018-12-21&g=2018-12-21,21-12-2018
31,/Hoofdstuk2/Paragraaf1/Artikel32,"Nadat de Koning de uitoefening van het koninklijk gezag heeft aangevangen, wordt hij zodra mogelijk bedigd en ingehuldigd in de hoofdstad Amsterdam in een openbare verenigde vergadering van de Staten-Generaal. Hij zweert of belooft trouw aan de Grondwet en een getrouwe vervulling van zijn ambt. De wet stelt nadere regels vast.",1.0:c:BWBR0001840&artikel=32&g=2018-12-21,jci1.3:c:BWBR0001840&hoofdstuk=2&paragraaf=1&artikel=32&z=2018-12-21&g=2018-12-21,21-12-2018
32,/Hoofdstuk2/Paragraaf1/Artikel33,"De Koning oefent het koninklijk gezag eerst uit, nadat hij de leeftijd van achttien jaar heeft bereikt.",1.0:c:BWBR0001840&artikel=33&g=2018-12-21,jci1.3:c:BWBR0001840&hoofdstuk=2&paragraaf=1&artikel=33&z=2018-12-21&g=2018-12-21,21-12-2018
33,/Hoofdstuk2/Paragraaf1/Artikel34,De wet regelt het ouderlijk gezag en de voogdij over de minderjarige Koning en het toezicht daarop. De Staten-Generaal beraadslagen en besluiten ter zake in verenigde vergadering.,1.0:c:BWBR0001840&artikel=34&g=2018-12-21,jci1.3:c:BWBR0001840&hoofdstuk=2&paragraaf=1&artikel=34&z=2018-12-21&g=2018-12-21,21-12-2018
34,/Hoofdstuk2/Paragraaf1/Artikel35," $ Lid1 :  $  Wanneer de ministerraad van oordeel is dat de Koning buiten staat is het koninklijk gezag uit te oefenen, bericht hij dit onder overlegging van het daartoe gevraagde advies van de Raad van State aan de Staten-Generaal, die daarop in verenigde vergadering bijeenkomen.  $ Lid2 :  $  Delen de Staten-Generaal dit oordeel, dan verklaren zij dat de Koning buiten staat is het koninklijk gezag uit te oefenen. Deze verklaring wordt bekend gemaakt op last van de voorzitter der vergadering en treedt terstond in werking.  $ Lid3 :  $  Zodra de Koning weer in staat is het koninklijk gezag uit te oefenen, wordt dit bij de wet verklaard. De Staten-Generaal beraadslagen en besluiten ter zake in verenigde vergadering. Terstond na de bekendmaking van deze wet hervat de Koning de uitoefening van het koninklijk gezag.  $ Lid4 :  $  De wet regelt zo nodig het toezicht over de persoon van de Koning indien hij buiten staat is verklaard het koninklijk gezag uit te oefenen. De Staten-Generaal beraadslagen en besluiten ter zake in verenigde vergadering.",1.0:c:BWBR0001840&artikel=35&g=2018-12-21,jci1.3:c:BWBR0001840&hoofdstuk=2&paragraaf=1&artikel=35&z=2018-12-21&g=2018-12-21,21-12-2018
35,/Hoofdstuk2/Paragraaf1/Artikel36,"De Koning kan de uitoefening van het koninklijk gezag tijdelijk neerleggen en die uitoefening hervatten krachtens een wet, waarvan het voorstel door of vanwege hem wordt ingediend. De Staten-Generaal beraadslagen en besluiten ter zake in verenigde vergadering.",1.0:c:BWBR0001840&artikel=36&g=2018-12-21,jci1.3:c:BWBR0001840&hoofdstuk=2&paragraaf=1&artikel=36&z=2018-12-21&g=2018-12-21,21-12-2018
36,/Hoofdstuk2/Paragraaf1/Artikel37," $ Lid1 :  $   $ Onderdeela :  $  zolang de Koning de leeftijd van achttien jaar niet heeft bereikt;  $ Onderdeelb :  $  indien een nog niet geboren kind tot het koningschap geroepen kan zijn;  $ Onderdeelc :  $  indien de Koning buiten staat is verklaard het koninklijk gezag uit te oefenen;  $ Onderdeeld :  $  indien de Koning de uitoefening van het koninklijk gezag tijdelijk heeft neergelegd;  $ Onderdeele :  $  zolang na het overlijden van de Koning of na diens afstand van het koningschap een opvolger ontbreekt.  $ Lid2 :  $  De regent wordt benoemd bij de wet. De Staten-Generaal beraadslagen en besluiten ter zake in verenigde vergadering.  $ Lid3 :  $  In de gevallen, genoemd in het eerste lid onder c en d, is de nakomeling van de Koning die zijn vermoedelijke opvolger is, van rechtswege regent indien hij de leeftijd van achttien jaar heeft bereikt.  $ Lid4 :  $  De regent zweert of belooft trouw aan de Grondwet en een getrouwe vervulling van zijn ambt, in een verenigde vergadering van de Staten-Generaal. De wet geeft nadere regels omtrent het regentschap en kan voorzien in de opvolging en de vervanging daarin. De Staten-Generaal beraadslagen en besluiten ter zake in verenigde vergadering.  $ Lid5 :  $  Op de regent zijn de  en  van overeenkomstige toepassing.artikelen 35 Op de regent zijn de  en  van overeenkomstige toepassing.",1.0:c:BWBR0001840&artikel=37&g=2018-12-21,jci1.3:c:BWBR0001840&hoofdstuk=2&paragraaf=1&artikel=37&z=2018-12-21&g=2018-12-21,21-12-2018
37,/Hoofdstuk2/Paragraaf1/Artikel38,"Zolang niet in de uitoefening van het koninklijk gezag is voorzien, wordt dit uitgeoefend door de Raad van State.",1.0:c:BWBR0001840&artikel=38&g=2018-12-21,jci1.3:c:BWBR0001840&hoofdstuk=2&paragraaf=1&artikel=38&z=2018-12-21&g=2018-12-21,21-12-2018
38,/Hoofdstuk2/Paragraaf1/Artikel39,"De wet regelt, wie lid is van het koninklijk huis.",1.0:c:BWBR0001840&artikel=39&g=2018-12-21,jci1.3:c:BWBR0001840&hoofdstuk=2&paragraaf=1&artikel=39&z=2018-12-21&g=2018-12-21,21-12-2018
39,/Hoofdstuk2/Paragraaf1/Artikel40," $ Lid1 :  $  De Koning ontvangt jaarlijks ten laste van het Rijk uitkeringen naar regels bij de wet te stellen. Deze wet bepaalt aan welke andere leden van het koninklijk huis uitkeringen ten laste van het Rijk worden toegekend en regelt deze uitkeringen.  $ Lid2 :  $  De door hen ontvangen uitkeringen ten laste van het Rijk, alsmede de vermogensbestanddelen welke dienstbaar zijn aan de uitoefening van hun functie, zijn vrij van persoonlijke belastingen. Voorts is hetgeen de Koning of zijn vermoedelijke opvolger krachtens erfrecht of door schenking verkrijgt van een lid van het koninklijk huis vrij van de rechten van successie, overgang en schenking. Verdere vrijdom van belasting kan bij de wet worden verleend.  $ Lid3 :  $  De kamers der Staten-Generaal kunnen voorstellen van in de vorige leden bedoelde wetten alleen aannemen met ten minste twee derden van het aantal uitgebrachte stemmen.",1.0:c:BWBR0001840&artikel=40&g=2018-12-21,jci1.3:c:BWBR0001840&hoofdstuk=2&paragraaf=1&artikel=40&z=2018-12-21&g=2018-12-21,21-12-2018
40,/Hoofdstuk2/Paragraaf1/Artikel41,"De Koning richt, met inachtneming van het openbaar belang, zijn Huis in.",1.0:c:BWBR0001840&artikel=41&g=2018-12-21,jci1.3:c:BWBR0001840&hoofdstuk=2&paragraaf=1&artikel=41&z=2018-12-21&g=2018-12-21,21-12-2018
41,/Hoofdstuk2/Paragraaf2/Artikel42, $ Lid1 :  $  De regering wordt gevormd door de Koning en de ministers.  $ Lid2 :  $  De Koning is onschendbaar; de ministers zijn verantwoordelijk.,1.0:c:BWBR0001840&artikel=42&g=2018-12-21,jci1.3:c:BWBR0001840&hoofdstuk=2&paragraaf=2&artikel=42&z=2018-12-21&g=2018-12-21,21-12-2018
42,/Hoofdstuk2/Paragraaf2/Artikel43,De minister-president en de overige ministers worden bij koninklijk besluit benoemd en ontslagen.,1.0:c:BWBR0001840&artikel=43&g=2018-12-21,jci1.3:c:BWBR0001840&hoofdstuk=2&paragraaf=2&artikel=43&z=2018-12-21&g=2018-12-21,21-12-2018
43,/Hoofdstuk2/Paragraaf2/Artikel44, $ Lid1 :  $  Bij koninklijk besluit worden ministeries ingesteld. Zij staan onder leiding van een minister.  $ Lid2 :  $  Ook kunnen ministers worden benoemd die niet belast zijn met de leiding van een ministerie.,1.0:c:BWBR0001840&artikel=44&g=2018-12-21,jci1.3:c:BWBR0001840&hoofdstuk=2&paragraaf=2&artikel=44&z=2018-12-21&g=2018-12-21,21-12-2018
44,/Hoofdstuk2/Paragraaf2/Artikel45, $ Lid1 :  $  De ministers vormen te zamen de ministerraad.  $ Lid2 :  $  De minister-president is voorzitter van de ministerraad.  $ Lid3 :  $  De ministerraad beraadslaagt en besluit over het algemeen regeringsbeleid en bevordert de eenheid van dat beleid.,1.0:c:BWBR0001840&artikel=45&g=2018-12-21,jci1.3:c:BWBR0001840&hoofdstuk=2&paragraaf=2&artikel=45&z=2018-12-21&g=2018-12-21,21-12-2018
45,/Hoofdstuk2/Paragraaf2/Artikel46," $ Lid1 :  $  Bij koninklijk besluit kunnen staatssecretarissen worden benoemd en ontslagen.  $ Lid2 :  $  Een staatssecretaris treedt in de gevallen waarin de minister het nodig acht en met inachtneming van diens aanwijzingen, in zijn plaats als minister op. De staatssecretaris is uit dien hoofde verantwoordelijk, onverminderd de verantwoordelijkheid van de minister.",1.0:c:BWBR0001840&artikel=46&g=2018-12-21,jci1.3:c:BWBR0001840&hoofdstuk=2&paragraaf=2&artikel=46&z=2018-12-21&g=2018-12-21,21-12-2018
46,/Hoofdstuk2/Paragraaf2/Artikel47,Alle wetten en koninklijke besluiten worden door de Koning en door een of meer ministers of staatssecretarissen ondertekend.,1.0:c:BWBR0001840&artikel=47&g=2018-12-21,jci1.3:c:BWBR0001840&hoofdstuk=2&paragraaf=2&artikel=47&z=2018-12-21&g=2018-12-21,21-12-2018
