,Nummer,Lid,Opsomming niveau 1,Opsomming niveau 2,Opsomming niveau 3,Zin,Brontekst,Versie,jci 1.3
177,Hoofdstuk2,Paragraaf6,Artikel2.31,Onderdeelc,,,"een verantwoordingsstaat, voorzien van een toelichting per artikel;",01-01-2018,jci1.3:c:BWBR0039429&hoofdstuk=2&paragraaf=6&artikel=2.31&o=c&z=2020-01-01&g=2020-01-01
178,Hoofdstuk2,Paragraaf6,Artikel2.31,Onderdeeld,,,"indien van toepassing, een financile staat van een agentschap als bedoeld in ;artikel 2.33",01-01-2018,jci1.3:c:BWBR0039429&hoofdstuk=2&paragraaf=6&artikel=2.31&o=d&z=2020-01-01&g=2020-01-01
179,Hoofdstuk2,Paragraaf6,Artikel2.31,Onderdeele,,,"een saldibalans, voorzien van een toelichting.",01-01-2018,jci1.3:c:BWBR0039429&hoofdstuk=2&paragraaf=6&artikel=2.31&o=e&z=2020-01-01&g=2020-01-01
180,Hoofdstuk2,Paragraaf6,Artikel2.32,Lid1,,,De verantwoordingsstaat wordt op basis van het van toepassing zijnde begrotingsstelsel opgesteld.,01-01-2018,jci1.3:c:BWBR0039429&hoofdstuk=2&paragraaf=6&artikel=2.32&lid=1&z=2020-01-01&g=2020-01-01
181,Hoofdstuk2,Paragraaf6,Artikel2.32,Lid2,,,"De verantwoordingsstaat bevat, in de volgorde van de begrotingsartikelen in de begrotingsstaat, per begrotingsartikel in elk geval de volgende gegevens:",01-01-2018,jci1.3:c:BWBR0039429&hoofdstuk=2&paragraaf=6&artikel=2.32&lid=2&z=2020-01-01&g=2020-01-01
182,Hoofdstuk2,Paragraaf6,Artikel2.32,Lid2,Onderdeela,,het artikelnummer;,01-01-2018,jci1.3:c:BWBR0039429&hoofdstuk=2&paragraaf=6&artikel=2.32&lid=2&o=a&z=2020-01-01&g=2020-01-01
183,Hoofdstuk2,Paragraaf6,Artikel2.32,Lid2,Onderdeelb,,de artikelomschrijving;,01-01-2018,jci1.3:c:BWBR0039429&hoofdstuk=2&paragraaf=6&artikel=2.32&lid=2&o=b&z=2020-01-01&g=2020-01-01
184,Hoofdstuk2,Paragraaf6,Artikel2.32,Lid2,Onderdeelc,,"het bedrag dat voor financile verplichtingen in de begrotingsstaat behorende bij de wet tot vaststelling van de begrotingsstaten is vastgesteld, met daarnaast opgenomen het gerealiseerde bedrag;",01-01-2018,jci1.3:c:BWBR0039429&hoofdstuk=2&paragraaf=6&artikel=2.32&lid=2&o=c&z=2020-01-01&g=2020-01-01
185,Hoofdstuk2,Paragraaf6,Artikel2.32,Lid2,Onderdeeld,,"het bedrag dat voor kasuitgaven in de begrotingsstaat behorende bij de wet tot vaststelling van de begrotingsstaten is vastgesteld, met daarnaast opgenomen het gerealiseerde bedrag;",01-01-2018,jci1.3:c:BWBR0039429&hoofdstuk=2&paragraaf=6&artikel=2.32&lid=2&o=d&z=2020-01-01&g=2020-01-01
186,Hoofdstuk2,Paragraaf6,Artikel2.32,Lid2,Onderdeele,,"het bedrag dat aan kasontvangsten in de begrotingsstaat behorende bij de wet tot vaststelling van de begrotingsstaten is vastgesteld, met daarnaast opgenomen het gerealiseerde bedrag.",01-01-2018,jci1.3:c:BWBR0039429&hoofdstuk=2&paragraaf=6&artikel=2.32&lid=2&o=e&z=2020-01-01&g=2020-01-01
187,Hoofdstuk2,Paragraaf6,Artikel2.32,Lid3,,,Het gerealiseerde bedrag voor de uitgaven dat wordt opgenomen in de verantwoordingsstaat bij het begrotingsartikel  is nihil.Nog onverdeeld,01-01-2018,jci1.3:c:BWBR0039429&hoofdstuk=2&paragraaf=6&artikel=2.32&lid=3&z=2020-01-01&g=2020-01-01
188,Hoofdstuk2,Paragraaf6,Artikel2.33,Lid1,,,Een agentschap heeft een afzonderlijke financile staat die wordt opgenomen bij de verantwoordingsstaat van het ministerie waaronder het agentschap ressorteert.,01-01-2018,jci1.3:c:BWBR0039429&hoofdstuk=2&paragraaf=6&artikel=2.33&lid=1&z=2020-01-01&g=2020-01-01
189,Hoofdstuk2,Paragraaf6,Artikel2.33,Lid2,,,De financile staat van een agentschap wordt opgesteld op basis van het van toepassing zijnde begrotingsstelsel.,01-01-2018,jci1.3:c:BWBR0039429&hoofdstuk=2&paragraaf=6&artikel=2.33&lid=2&z=2020-01-01&g=2020-01-01
190,Hoofdstuk2,Paragraaf6,Artikel2.33,Lid3,,,"De financile staat van een agentschap bevat de bedragen die in de financile staat, bedoeld in , bij de wet tot vaststelling van de begrotingsstaten zijn vastgesteld met daarnaast opgenomen de gerealiseerde bedragen.artikel 2.6",01-01-2018,jci1.3:c:BWBR0039429&hoofdstuk=2&paragraaf=6&artikel=2.33&lid=3&z=2020-01-01&g=2020-01-01
191,Hoofdstuk2,Paragraaf6,Artikel2.34,Lid1,,,"De saldibalans bevat in elk geval de saldi, zoals deze aan het eind van het begrotingsjaar uit de financile administratie blijken, van:",01-01-2018,jci1.3:c:BWBR0039429&hoofdstuk=2&paragraaf=6&artikel=2.34&lid=1&z=2020-01-01&g=2020-01-01
192,Hoofdstuk2,Paragraaf6,Artikel2.34,Lid1,Onderdeela,,de kasuitgaven en de kasontvangsten die binnen en buiten begrotingsverband zijn geboekt;,01-01-2018,jci1.3:c:BWBR0039429&hoofdstuk=2&paragraaf=6&artikel=2.34&lid=1&o=a&z=2020-01-01&g=2020-01-01
193,Hoofdstuk2,Paragraaf6,Artikel2.34,Lid1,Onderdeelb,,"de kasreserves, bedoeld in , en de begrotingsreserves, bedoeld in ;artikel 2.20, achtste lid",01-01-2018,jci1.3:c:BWBR0039429&hoofdstuk=2&paragraaf=6&artikel=2.34&lid=1&o=b&z=2020-01-01&g=2020-01-01
194,Hoofdstuk2,Paragraaf6,Artikel2.34,Lid1,Onderdeelc,,de openstaande financile verplichtingen ten aanzien van derden met uitzondering van de garantieverplichtingen;,01-01-2018,jci1.3:c:BWBR0039429&hoofdstuk=2&paragraaf=6&artikel=2.34&lid=1&o=c&z=2020-01-01&g=2020-01-01
195,Hoofdstuk2,Paragraaf6,Artikel2.34,Lid1,Onderdeeld,,de garantieverplichtingen ten aanzien van derden;,01-01-2018,jci1.3:c:BWBR0039429&hoofdstuk=2&paragraaf=6&artikel=2.34&lid=1&o=d&z=2020-01-01&g=2020-01-01
196,Hoofdstuk2,Paragraaf6,Artikel2.34,Lid1,Onderdeele,,de vorderingen en de schulden ten aanzien van derden met inbegrip van de voorschotten;,01-01-2018,jci1.3:c:BWBR0039429&hoofdstuk=2&paragraaf=6&artikel=2.34&lid=1&o=e&z=2020-01-01&g=2020-01-01
197,Hoofdstuk2,Paragraaf6,Artikel2.34,Lid1,Onderdeelf,,de departementale kassen.,01-01-2018,jci1.3:c:BWBR0039429&hoofdstuk=2&paragraaf=6&artikel=2.34&lid=1&o=f&z=2020-01-01&g=2020-01-01
198,Hoofdstuk2,Paragraaf6,Artikel2.34,Lid2,,,De toelichting bij de saldibalans biedt inzicht in de mutaties in de saldi ten opzichte van de stand van die saldi in de voorafgaande saldibalans.,01-01-2018,jci1.3:c:BWBR0039429&hoofdstuk=2&paragraaf=6&artikel=2.34&lid=2&z=2020-01-01&g=2020-01-01
199,Hoofdstuk2,Paragraaf6,Artikel2.35,Lid1,,,Het Financieel jaarverslag van het Rijk bevat met betrekking tot het begrotingsjaar in elk geval:,01-01-2018,jci1.3:c:BWBR0039429&hoofdstuk=2&paragraaf=6&artikel=2.35&lid=1&z=2020-01-01&g=2020-01-01
200,Hoofdstuk2,Paragraaf6,Artikel2.35,Lid1,Onderdeela,,het gerealiseerde budgettaire totaalbeeld van de rijksbegroting en de niet tot de rijksbegroting behorende budgetdisciplinesectoren;,01-01-2018,jci1.3:c:BWBR0039429&hoofdstuk=2&paragraaf=6&artikel=2.35&lid=1&o=a&z=2020-01-01&g=2020-01-01
201,Hoofdstuk2,Paragraaf6,Artikel2.35,Lid1,Onderdeelb,,een uiteenzetting over het financieel beheer van de ministeries en de colleges;,01-01-2018,jci1.3:c:BWBR0039429&hoofdstuk=2&paragraaf=6&artikel=2.35&lid=1&o=b&z=2020-01-01&g=2020-01-01
202,Hoofdstuk2,Paragraaf6,Artikel2.35,Lid1,Onderdeelc,,de rijksrekening;,01-01-2018,jci1.3:c:BWBR0039429&hoofdstuk=2&paragraaf=6&artikel=2.35&lid=1&o=c&z=2020-01-01&g=2020-01-01
203,Hoofdstuk2,Paragraaf6,Artikel2.35,Lid1,Onderdeeld,,de rijkssaldibalans.,01-01-2018,jci1.3:c:BWBR0039429&hoofdstuk=2&paragraaf=6&artikel=2.35&lid=1&o=d&z=2020-01-01&g=2020-01-01
204,Hoofdstuk2,Paragraaf6,Artikel2.35,Lid2,,,"De rijksrekening is het verantwoordingsoverzicht van het Rijk, waarin per begroting zijn opgenomen:",01-01-2018,jci1.3:c:BWBR0039429&hoofdstuk=2&paragraaf=6&artikel=2.35&lid=2&z=2020-01-01&g=2020-01-01
205,Hoofdstuk2,Paragraaf6,Artikel2.35,Lid2,Onderdeela,,"de totaalbedragen van alle geraamde uitgaven en ontvangsten, zoals deze in de wet tot vaststelling van de begrotingsstaten zijn vastgesteld;",01-01-2018,jci1.3:c:BWBR0039429&hoofdstuk=2&paragraaf=6&artikel=2.35&lid=2&o=a&z=2020-01-01&g=2020-01-01
206,Hoofdstuk2,Paragraaf6,Artikel2.35,Lid2,Onderdeelb,,"de totaalbedragen van alle gerealiseerde uitgaven en ontvangsten, zoals deze uit de verantwoordingsstaten blijken;",01-01-2018,jci1.3:c:BWBR0039429&hoofdstuk=2&paragraaf=6&artikel=2.35&lid=2&o=b&z=2020-01-01&g=2020-01-01
207,Hoofdstuk2,Paragraaf6,Artikel2.35,Lid2,Onderdeelc,,"het verschil tussen de bedragen, bedoeld onder a en b.",01-01-2018,jci1.3:c:BWBR0039429&hoofdstuk=2&paragraaf=6&artikel=2.35&lid=2&o=c&z=2020-01-01&g=2020-01-01
208,Hoofdstuk2,Paragraaf6,Artikel2.35,Lid3,,,"De uitgaven en ontvangsten, bedoeld in het tweede lid, worden opgenomen op basis van het begrotingsstelsel dat voor die uitgaven en ontvangsten geldt.",01-01-2018,jci1.3:c:BWBR0039429&hoofdstuk=2&paragraaf=6&artikel=2.35&lid=3&z=2020-01-01&g=2020-01-01
209,Hoofdstuk2,Paragraaf6,Artikel2.35,Lid4,,,"De rijkssaldibalans is het verantwoordingsoverzicht van het Rijk, waarin in elk geval de totaalbedragen van alle saldibalansen, bedoeld in , en de saldi, bedoeld in , zijn opgenomen.artikel 2.31, eerste lid, onder e",01-01-2018,jci1.3:c:BWBR0039429&hoofdstuk=2&paragraaf=6&artikel=2.35&lid=4&z=2020-01-01&g=2020-01-01
210,Hoofdstuk2,Paragraaf6,Artikel2.36,,,,De slotverschillen worden per begrotingsstaat bij wet vastgesteld.,01-01-2018,jci1.3:c:BWBR0039429&hoofdstuk=2&paragraaf=6&artikel=2.36&z=2020-01-01&g=2020-01-01
211,Hoofdstuk2,Paragraaf7,Artikel2.37,Lid1,,,"Onze Minister van Financin zendt de jaarverslagen, bedoeld in , jaarlijks uiterlijk op 31maart van het jaar volgend op het begrotingsjaar voor onderzoek naar de Algemene Rekenkamer. De rapporten over de jaarverslagen die zijn opgesteld door de Auditdienst Rijk worden gelijktijdig meegestuurd.artikel 2.31",01-01-2018,jci1.3:c:BWBR0039429&hoofdstuk=2&paragraaf=7&artikel=2.37&lid=1&z=2020-01-01&g=2020-01-01
212,Hoofdstuk2,Paragraaf7,Artikel2.37,Lid2,,,"Onze Minister van Financin biedt de door de Algemene Rekenkamer onderzochte jaarverslagen op de derde woensdag van mei volgend op het jaar waarop de jaarverslagen betrekking hebben aan de Tweede Kamer der Staten-Generaal aan, tenzij deze datum valt in een periode wanneer de Tweede Kamer der Staten-Generaal met reces is of wanneer een nationale feestdag is. In dat geval biedt Onze Minister van Financin de jaarverslagen, na overleg met de voorzitter van de Tweede Kamer der Staten-Generaal en de president van de Algemene Rekenkamer, uiterlijk op 1juni van hetzelfde jaar aan.",01-01-2018,jci1.3:c:BWBR0039429&hoofdstuk=2&paragraaf=7&artikel=2.37&lid=2&z=2020-01-01&g=2020-01-01
213,Hoofdstuk2,Paragraaf7,Artikel2.37,Lid3,,,"In voorkomende gevallen zendt Onze Minister die het aangaat zijn standpunt over het bezwaar van de Algemene Rekenkamer, bedoeld in , zo spoedig mogelijk, doch in elk geval vr de behandeling van het jaarverslag door de Tweede Kamer der Staten-Generaal, naar die Kamer.artikel 7.22, eerste lid",01-01-2018,jci1.3:c:BWBR0039429&hoofdstuk=2&paragraaf=7&artikel=2.37&lid=3&z=2020-01-01&g=2020-01-01
214,Hoofdstuk2,Paragraaf7,Artikel2.38,Lid1,,,"Onze Minister van Financin zendt het Financieel jaarverslag van het Rijk, bedoeld in , uiterlijk op 21april van het jaar volgend op het begrotingsjaar voor onderzoek naar de Algemene Rekenkamer. Het rapport over het jaarverslag dat is opgesteld door de Auditdienst Rijk wordt gelijktijdig meegestuurd.artikel 2.35",01-01-2018,jci1.3:c:BWBR0039429&hoofdstuk=2&paragraaf=7&artikel=2.38&lid=1&z=2020-01-01&g=2020-01-01
215,Hoofdstuk2,Paragraaf7,Artikel2.38,Lid2,,,"Onze Minister van Financin biedt het door de Algemene Rekenkamer onderzochte Financieel jaarverslag van het Rijk op de derde woensdag van mei volgend op het jaar waarop het begrotingsjaar betrekking heeft aan de Staten-Generaal aan, tenzij deze datum valt in een periode wanneer de Tweede Kamer der Staten-Generaal met reces is of wanneer een nationale feestdag is. In dat geval biedt Onze Minister van Financin het Financieel jaarverslag van het Rijk, na overleg met de voorzitter van de Tweede Kamer der Staten-Generaal en de president van de Algemene Rekenkamer, uiterlijk op 1juni van hetzelfde jaar aan.",01-01-2018,jci1.3:c:BWBR0039429&hoofdstuk=2&paragraaf=7&artikel=2.38&lid=2&z=2020-01-01&g=2020-01-01
216,Hoofdstuk2,Paragraaf7,Artikel2.39,Lid1,,,"Wij dienen op de derde woensdag van mei volgend op het jaar waarop de begrotingsstaten betrekking hebben de voorstellen van wet tot vaststelling van de slotverschillen bij de Tweede Kamer der Staten-Generaal in, tenzij deze datum valt in een periode wanneer de Tweede Kamer der Staten-Generaal met reces is of wanneer een nationale feestdag is. In dat geval dienen Wij de voorstellen van wet, na overleg met de voorzitter van de Tweede Kamer der Staten-Generaal en de president van de Algemene Rekenkamer, uiterlijk op 1juni van hetzelfde jaar in.",01-01-2018,jci1.3:c:BWBR0039429&hoofdstuk=2&paragraaf=7&artikel=2.39&lid=1&z=2020-01-01&g=2020-01-01
217,Hoofdstuk2,Paragraaf7,Artikel2.39,Lid2,,,In afwijking van het eerste lid kunnen Wij Onze Minister van Financin machtigen de voorstellen van wet tot vaststelling van de slotverschillen bij de Tweede Kamer der Staten-Generaal in te dienen.,01-01-2018,jci1.3:c:BWBR0039429&hoofdstuk=2&paragraaf=7&artikel=2.39&lid=2&z=2020-01-01&g=2020-01-01
218,Hoofdstuk2,Paragraaf8,Artikel2.40,Lid1,,,"Decharge aan Onze Ministers, ieder met betrekking tot het door hem gevoerde financieel beheer, wordt verleend aan de hand van het betrokken jaarverslag door een daartoe strekkende uitspraak van elk van de Kamers der Staten-Generaal.",01-01-2018,jci1.3:c:BWBR0039429&hoofdstuk=2&paragraaf=8&artikel=2.40&lid=1&z=2020-01-01&g=2020-01-01
219,Hoofdstuk2,Paragraaf8,Artikel2.40,Lid2,,,"Decharge wordt niet eerder verleend dan nadat de verklaring van goedkeuring van de Algemene Rekenkamer, bedoeld in , is ontvangen en het voorstel van wet tot vaststelling van de slotverschillen, bedoeld in , en in voorkomende gevallen een voorstel van een indemniteitswet als bedoeld in , zijn aangenomen.artikel 7.14, tweede lid",01-01-2018,jci1.3:c:BWBR0039429&hoofdstuk=2&paragraaf=8&artikel=2.40&lid=2&z=2020-01-01&g=2020-01-01
220,Hoofdstuk2,Paragraaf8,Artikel2.40,Lid3,,,"Nadat de Tweede Kamer der Staten-Generaal decharge heeft verleend, plaatst de voorzitter van die Kamer op het betrokken jaarverslag een aantekening, waaruit de verlening van de decharge en de datum waarop die heeft plaatsgevonden, blijken. De voorzitter van de Tweede Kamer der Staten-Generaal zendt het jaarverslag vervolgens aan de voorzitter van de Eerste Kamer der Staten-Generaal.",01-01-2018,jci1.3:c:BWBR0039429&hoofdstuk=2&paragraaf=8&artikel=2.40&lid=3&z=2020-01-01&g=2020-01-01
221,Hoofdstuk2,Paragraaf8,Artikel2.40,Lid4,,,"Nadat de Eerste Kamer der Staten-Generaal decharge heeft verleend, plaatst de voorzitter van die Kamer op het betrokken jaarverslag een aantekening, waaruit de verlening van de decharge en de datum waarop die heeft plaatsgevonden, blijken. De voorzitter van de Eerste Kamer der Staten-Generaal zendt het jaarverslag vervolgens aan Onze Minister van Financin.",01-01-2018,jci1.3:c:BWBR0039429&hoofdstuk=2&paragraaf=8&artikel=2.40&lid=4&z=2020-01-01&g=2020-01-01
222,Hoofdstuk3,Paragraaf1,Artikel3.1,,,,"Voorstellen, voornemens en toezeggingen bevatten een toelichting waarin wordt ingegaan op:",01-01-2018,jci1.3:c:BWBR0039429&hoofdstuk=3&paragraaf=1&artikel=3.1&z=2020-01-01&g=2020-01-01
223,Hoofdstuk3,Paragraaf1,Artikel3.1,Onderdeela,,,"de doelstellingen, de doeltreffendheid en de doelmatigheid die worden nagestreefd;",01-01-2018,jci1.3:c:BWBR0039429&hoofdstuk=3&paragraaf=1&artikel=3.1&o=a&z=2020-01-01&g=2020-01-01
224,Hoofdstuk3,Paragraaf1,Artikel3.1,Onderdeelb,,,de beleidsinstrumenten die worden ingezet;,01-01-2018,jci1.3:c:BWBR0039429&hoofdstuk=3&paragraaf=1&artikel=3.1&o=b&z=2020-01-01&g=2020-01-01
225,Hoofdstuk3,Paragraaf1,Artikel3.1,Onderdeelc,,,"de financile gevolgen voor het Rijk en, waar mogelijk, de financile gevolgen voor maatschappelijke sectoren.",01-01-2018,jci1.3:c:BWBR0039429&hoofdstuk=3&paragraaf=1&artikel=3.1&o=c&z=2020-01-01&g=2020-01-01
226,Hoofdstuk3,Paragraaf1,Artikel3.2,,,,Onze Ministers en de colleges zijn verantwoordelijk voor de ordelijkheid en controleerbaarheid van het begrotingsbeheer.,01-01-2018,jci1.3:c:BWBR0039429&hoofdstuk=3&paragraaf=1&artikel=3.2&z=2020-01-01&g=2020-01-01
227,Hoofdstuk3,Paragraaf1,Artikel3.3,,,,"Onze Ministers en de colleges zijn verantwoordelijk voor de doelmatigheid, rechtmatigheid, ordelijkheid en controleerbaarheid van het financieel beheer.",01-01-2018,jci1.3:c:BWBR0039429&hoofdstuk=3&paragraaf=1&artikel=3.3&z=2020-01-01&g=2020-01-01
228,Hoofdstuk3,Paragraaf1,Artikel3.4,,,,"Onze Ministers en de colleges zijn verantwoordelijk voor de doelmatigheid, rechtmatigheid, ordelijkheid en controleerbaarheid van het verwerven, het beheren en het afstoten van materieel.",01-01-2018,jci1.3:c:BWBR0039429&hoofdstuk=3&paragraaf=1&artikel=3.4&z=2020-01-01&g=2020-01-01
229,Hoofdstuk3,Paragraaf2,Artikel3.5,Lid1,,,Financile administraties worden betrouwbaar en controleerbaar ingericht en gevoerd.,01-01-2018,jci1.3:c:BWBR0039429&hoofdstuk=3&paragraaf=2&artikel=3.5&lid=1&z=2020-01-01&g=2020-01-01
230,Hoofdstuk3,Paragraaf2,Artikel3.5,Lid2,,,"De financile administratie wordt zodanig ingericht dat daaraan de financile informatie kan worden ontleend die krachtens het in  bepaalde en de nadere regels, bedoeld in , in de begroting en het jaarverslag wordt opgenomen.hoofdstuk 2",01-01-2018,jci1.3:c:BWBR0039429&hoofdstuk=3&paragraaf=2&artikel=3.5&lid=2&z=2020-01-01&g=2020-01-01
231,Hoofdstuk3,Paragraaf2,Artikel3.6,,,,Financile begrotingsinformatie voldoet aan:,01-01-2018,jci1.3:c:BWBR0039429&hoofdstuk=3&paragraaf=2&artikel=3.6&z=2020-01-01&g=2020-01-01
232,Hoofdstuk3,Paragraaf2,Artikel3.6,Onderdeela,,,de norm van betrouwbaarheid en ordelijkheid;,01-01-2018,jci1.3:c:BWBR0039429&hoofdstuk=3&paragraaf=2&artikel=3.6&o=a&z=2020-01-01&g=2020-01-01
233,Hoofdstuk3,Paragraaf2,Artikel3.6,Onderdeelb,,,"de regels voor het inrichten van de rijksbegroting, bedoeld in .artikel 4.20, eerste lid, aanhef en onderdeel a",01-01-2018,jci1.3:c:BWBR0039429&hoofdstuk=3&paragraaf=2&artikel=3.6&o=b&z=2020-01-01&g=2020-01-01
234,Hoofdstuk3,Paragraaf2,Artikel3.7,,,,Voor niet-financile begrotingsinformatie geldt dat deze:,01-01-2018,jci1.3:c:BWBR0039429&hoofdstuk=3&paragraaf=2&artikel=3.7&z=2020-01-01&g=2020-01-01
235,Hoofdstuk3,Paragraaf2,Artikel3.7,Onderdeela,,,voldoet aan de norm van betrouwbare totstandkoming;,01-01-2018,jci1.3:c:BWBR0039429&hoofdstuk=3&paragraaf=2&artikel=3.7&o=a&z=2020-01-01&g=2020-01-01
236,Hoofdstuk3,Paragraaf2,Artikel3.7,Onderdeelb,,,niet strijdig is met de financile begrotingsinformatie.,01-01-2018,jci1.3:c:BWBR0039429&hoofdstuk=3&paragraaf=2&artikel=3.7&o=b&z=2020-01-01&g=2020-01-01
237,Hoofdstuk3,Paragraaf2,Artikel3.8,Lid1,,,Financile verantwoordingsinformatie voldoet aan:,01-01-2018,jci1.3:c:BWBR0039429&hoofdstuk=3&paragraaf=2&artikel=3.8&lid=1&z=2020-01-01&g=2020-01-01
238,Hoofdstuk3,Paragraaf2,Artikel3.8,Lid1,Onderdeela,,de norm van betrouwbaarheid en ordelijkheid;,01-01-2018,jci1.3:c:BWBR0039429&hoofdstuk=3&paragraaf=2&artikel=3.8&lid=1&o=a&z=2020-01-01&g=2020-01-01
239,Hoofdstuk3,Paragraaf2,Artikel3.8,Lid1,Onderdeelb,,de norm van rechtmatigheid;,01-01-2018,jci1.3:c:BWBR0039429&hoofdstuk=3&paragraaf=2&artikel=3.8&lid=1&o=b&z=2020-01-01&g=2020-01-01
240,Hoofdstuk3,Paragraaf2,Artikel3.8,Lid1,Onderdeelc,,"de regels voor het inrichten van de jaarverslagen, bedoeld in .artikel 4.20, eerste lid, aanhef en onder a",01-01-2018,jci1.3:c:BWBR0039429&hoofdstuk=3&paragraaf=2&artikel=3.8&lid=1&o=c&z=2020-01-01&g=2020-01-01
241,Hoofdstuk3,Paragraaf2,Artikel3.8,Lid2,,,"De financile verantwoordingsinformatie in de rijksrekening en de rijkssaldibalans van het Financieel jaarverslag van het Rijk, bedoeld in , sluit aan op de financile verantwoordingsinformatie in de verantwoordingsstaten en de saldibalansen van de jaarverslagen, bedoeld in .artikel 2.35, tweede en vierde lid",01-01-2018,jci1.3:c:BWBR0039429&hoofdstuk=3&paragraaf=2&artikel=3.8&lid=2&z=2020-01-01&g=2020-01-01
242,Hoofdstuk3,Paragraaf2,Artikel3.9,,,,Voor niet-financile verantwoordingsinformatie geldt dat deze:,01-01-2018,jci1.3:c:BWBR0039429&hoofdstuk=3&paragraaf=2&artikel=3.9&z=2020-01-01&g=2020-01-01
243,Hoofdstuk3,Paragraaf2,Artikel3.9,Onderdeela,,,voldoet aan de norm van betrouwbare totstandkoming;,01-01-2018,jci1.3:c:BWBR0039429&hoofdstuk=3&paragraaf=2&artikel=3.9&o=a&z=2020-01-01&g=2020-01-01
244,Hoofdstuk3,Paragraaf2,Artikel3.9,Onderdeelb,,,niet strijdig is met de financile verantwoordingsinformatie.,01-01-2018,jci1.3:c:BWBR0039429&hoofdstuk=3&paragraaf=2&artikel=3.9&o=b&z=2020-01-01&g=2020-01-01
245,Hoofdstuk3,Paragraaf2,Artikel3.10,,,,"Onze Minister van Financin stelt regels met betrekking tot de normen die gelden voor het rapporteren van fouten en onzekerheden in de financile verantwoordingsinformatie in de jaarverslagen, bedoeld in .artikel 2.31",01-01-2018,jci1.3:c:BWBR0039429&hoofdstuk=3&paragraaf=2&artikel=3.10&z=2020-01-01&g=2020-01-01
246,Hoofdstuk4,Paragraaf1,Artikel4.1,Lid1,,,"Onze Ministers, ieder met betrekking tot het beleid dat aan zijn begroting ten grondslag ligt, zijn verantwoordelijk voor:",01-01-2018,jci1.3:c:BWBR0039429&hoofdstuk=4&paragraaf=1&artikel=4.1&lid=1&z=2020-01-01&g=2020-01-01
247,Hoofdstuk4,Paragraaf1,Artikel4.1,Lid1,Onderdeela,,"het ontwikkelen, vaststellen en uitvoeren van het beleid;",01-01-2018,jci1.3:c:BWBR0039429&hoofdstuk=4&paragraaf=1&artikel=4.1&lid=1&o=a&z=2020-01-01&g=2020-01-01
248,Hoofdstuk4,Paragraaf1,Artikel4.1,Lid1,Onderdeelb,,het toezicht houden op het uitvoeren van het beleid;,01-01-2018,jci1.3:c:BWBR0039429&hoofdstuk=4&paragraaf=1&artikel=4.1&lid=1&o=b&z=2020-01-01&g=2020-01-01
249,Hoofdstuk4,Paragraaf1,Artikel4.1,Lid1,Onderdeelc,,het periodiek onderzoeken van de doeltreffendheid en doelmatigheid van het beleid;,01-01-2018,jci1.3:c:BWBR0039429&hoofdstuk=4&paragraaf=1&artikel=4.1&lid=1&o=c&z=2020-01-01&g=2020-01-01
250,Hoofdstuk4,Paragraaf1,Artikel4.1,Lid1,Onderdeeld,,de in de begroting opgenomen informatie;,01-01-2018,jci1.3:c:BWBR0039429&hoofdstuk=4&paragraaf=1&artikel=4.1&lid=1&o=d&z=2020-01-01&g=2020-01-01
251,Hoofdstuk4,Paragraaf1,Artikel4.1,Lid1,Onderdeele,,de in het jaarverslag opgenomen informatie.,01-01-2018,jci1.3:c:BWBR0039429&hoofdstuk=4&paragraaf=1&artikel=4.1&lid=1&o=e&z=2020-01-01&g=2020-01-01
252,Hoofdstuk4,Paragraaf1,Artikel4.1,Lid2,,,"Onze Ministers die belast zijn met de leiding van een ministerie, ieder met betrekking tot de begroting waarvoor hij verantwoordelijk is, zijn verantwoordelijk voor:",01-01-2018,jci1.3:c:BWBR0039429&hoofdstuk=4&paragraaf=1&artikel=4.1&lid=2&z=2020-01-01&g=2020-01-01
253,Hoofdstuk4,Paragraaf1,Artikel4.1,Lid2,Onderdeela,,de bedrijfsvoering van het ministerie;,01-01-2018,jci1.3:c:BWBR0039429&hoofdstuk=4&paragraaf=1&artikel=4.1&lid=2&o=a&z=2020-01-01&g=2020-01-01
254,Hoofdstuk4,Paragraaf1,Artikel4.1,Lid2,Onderdeelb,,het periodiek onderzoeken van de doeltreffendheid en doelmatigheid van die bedrijfsvoering;,01-01-2018,jci1.3:c:BWBR0039429&hoofdstuk=4&paragraaf=1&artikel=4.1&lid=2&o=b&z=2020-01-01&g=2020-01-01
255,Hoofdstuk4,Paragraaf1,Artikel4.1,Lid2,Onderdeelc,,het begrotingsbeheer en de daartoe gevoerde administraties;,01-01-2018,jci1.3:c:BWBR0039429&hoofdstuk=4&paragraaf=1&artikel=4.1&lid=2&o=c&z=2020-01-01&g=2020-01-01
256,Hoofdstuk4,Paragraaf1,Artikel4.1,Lid2,Onderdeeld,,het financieel beheer en de daartoe gevoerde administraties;,01-01-2018,jci1.3:c:BWBR0039429&hoofdstuk=4&paragraaf=1&artikel=4.1&lid=2&o=d&z=2020-01-01&g=2020-01-01
257,Hoofdstuk4,Paragraaf1,Artikel4.1,Lid2,Onderdeele,,het materieelbeheer voor zover dat betrekking heeft op roerende zaken en de daartoe gevoerde administraties.,01-01-2018,jci1.3:c:BWBR0039429&hoofdstuk=4&paragraaf=1&artikel=4.1&lid=2&o=e&z=2020-01-01&g=2020-01-01
258,Hoofdstuk4,Paragraaf1,Artikel4.2,Lid1,,,"Indien Onze Minister het beleid dat aan zijn begroting ten grondslag ligt niet zelf uitvoert, daarop toezicht houdt of de bedrijfsvoering verzorgt, draagt hij zorg voor het verkrijgen van de informatie die nodig is voor het afleggen van verantwoording in het jaarverslag, bedoeld in .artikel 2.31",01-01-2018,jci1.3:c:BWBR0039429&hoofdstuk=4&paragraaf=1&artikel=4.2&lid=1&z=2020-01-01&g=2020-01-01
259,Hoofdstuk4,Paragraaf1,Artikel4.2,Lid2,,,"Indien een organisatie die niet tot het Rijk behoort direct, indirect of voorwaardelijk een financile bijdrage ontvangt uit verschillende begrotingen als bedoeld in  dan wordt de informatie, bedoeld in het eerste lid, in afwijking van  opgenomen in het jaarverslag van Onze Minister die als eerste verantwoordelijk is voor de bijdrage.artikel 2.1",01-01-2018,jci1.3:c:BWBR0039429&hoofdstuk=4&paragraaf=1&artikel=4.2&lid=2&z=2020-01-01&g=2020-01-01
260,Hoofdstuk4,Paragraaf1,Artikel4.2,Lid3,,,"Indien bij of krachtens de wet aan de ontvanger van de financile bijdrage, bedoeld in het tweede lid, geen jaarlijkse verantwoording verplicht is gesteld, volstaat Onze Minister die het aangaat met het opnemen in het jaarverslag van de verantwoordingsinformatie die volgens het wettelijk voorschrift door de ontvanger aan Onze Minister die het aangaat wordt verstrekt.",01-01-2018,jci1.3:c:BWBR0039429&hoofdstuk=4&paragraaf=1&artikel=4.2&lid=3&z=2020-01-01&g=2020-01-01
261,Hoofdstuk4,Paragraaf1,Artikel4.3,Lid1,,,Onze Minister van Algemene Zaken is verantwoordelijk voor het beheer van de begroting van de Koning.,01-01-2018,jci1.3:c:BWBR0039429&hoofdstuk=4&paragraaf=1&artikel=4.3&lid=1&z=2020-01-01&g=2020-01-01
262,Hoofdstuk4,Paragraaf1,Artikel4.3,Lid2,,,Onze Minister van Binnenlandse Zaken en Koninkrijksrelaties is verantwoordelijk voor het beheer van de begroting van koninkrijksrelaties.,01-01-2018,jci1.3:c:BWBR0039429&hoofdstuk=4&paragraaf=1&artikel=4.3&lid=2&z=2020-01-01&g=2020-01-01
263,Hoofdstuk4,Paragraaf1,Artikel4.3,Lid3,,,Onze Minister van Financin is verantwoordelijk voor het beheer van de begroting van Nationale Schuld.,01-01-2018,jci1.3:c:BWBR0039429&hoofdstuk=4&paragraaf=1&artikel=4.3&lid=3&z=2020-01-01&g=2020-01-01
