,Nummer,Lid,Opsomming niveau 1,Opsomming niveau 2,Opsomming niveau 3,Zin,Brontekst,Versie,jci 1.3
341,Hoofdstuk4,Paragraaf6,Artikel4.20,Lid2,,,Onze Minister van Financin kan voor het Rijk regels stellen over:,01-01-2018,jci1.3:c:BWBR0039429&hoofdstuk=4&paragraaf=6&artikel=4.20&lid=2&z=2020-01-01&g=2020-01-01
342,Hoofdstuk4,Paragraaf6,Artikel4.20,Lid2,Onderdeela,,"de samenstelling, de organisatie en de doelen van een periodiek interdepartementaal overleg over financieel-economische aangelegenheden;",01-01-2018,jci1.3:c:BWBR0039429&hoofdstuk=4&paragraaf=6&artikel=4.20&lid=2&o=a&z=2020-01-01&g=2020-01-01
343,Hoofdstuk4,Paragraaf6,Artikel4.20,Lid2,Onderdeelb,,"de samenstelling, de organisatie, de taken en de informatievoorziening van het adviesorgaan van een ministerie met betrekking tot audit- en bedrijfsvoeringsaangelegenheden;",01-01-2018,jci1.3:c:BWBR0039429&hoofdstuk=4&paragraaf=6&artikel=4.20&lid=2&o=b&z=2020-01-01&g=2020-01-01
344,Hoofdstuk4,Paragraaf6,Artikel4.20,Lid2,Onderdeelc,,het materieelbeheer voor zover dat betrekking heeft op de roerende zaken van het Rijk en de administraties die ten behoeve van dat materieelbeheer worden bijgehouden;,01-01-2018,jci1.3:c:BWBR0039429&hoofdstuk=4&paragraaf=6&artikel=4.20&lid=2&o=c&z=2020-01-01&g=2020-01-01
345,Hoofdstuk4,Paragraaf6,Artikel4.20,Lid2,Onderdeeld,,het afstoten van overtollige roerende zaken van het Rijk;,01-01-2018,jci1.3:c:BWBR0039429&hoofdstuk=4&paragraaf=6&artikel=4.20&lid=2&o=d&z=2020-01-01&g=2020-01-01
346,Hoofdstuk4,Paragraaf6,Artikel4.20,Lid2,Onderdeele,,het toepassen van financile beleidsinstrumenten;,01-01-2018,jci1.3:c:BWBR0039429&hoofdstuk=4&paragraaf=6&artikel=4.20&lid=2&o=e&z=2020-01-01&g=2020-01-01
347,Hoofdstuk4,Paragraaf6,Artikel4.20,Lid2,Onderdeelf,,"de voorstellen, voornemens en toezeggingen, bedoeld in , en het periodiek onderzoeken van de doeltreffendheid en doelmatigheid van het beleid en de bedrijfsvoering;artikel 3.1, aanhef",01-01-2018,jci1.3:c:BWBR0039429&hoofdstuk=4&paragraaf=6&artikel=4.20&lid=2&o=f&z=2020-01-01&g=2020-01-01
348,Hoofdstuk4,Paragraaf6,Artikel4.20,Lid2,Onderdeelg,,de inrichting en het beheer van de agentschappen.,01-01-2018,jci1.3:c:BWBR0039429&hoofdstuk=4&paragraaf=6&artikel=4.20&lid=2&o=g&z=2020-01-01&g=2020-01-01
349,Hoofdstuk4,Paragraaf6,Artikel4.20,Lid3,,,"De regels, bedoeld in het eerste lid, onderdelen a en c, en het tweede lid, onderdeel f, worden niet vastgesteld, dan nadat daarover op hoofdlijnen overleg met de Tweede Kamer der Staten-Generaal is gevoerd.",01-01-2018,jci1.3:c:BWBR0039429&hoofdstuk=4&paragraaf=6&artikel=4.20&lid=3&z=2020-01-01&g=2020-01-01
350,Hoofdstuk4,Paragraaf6,Artikel4.20,Lid4,,,Bij algemene maatregel van bestuur worden regels gesteld over:,01-01-2018,jci1.3:c:BWBR0039429&hoofdstuk=4&paragraaf=6&artikel=4.20&lid=4&z=2020-01-01&g=2020-01-01
351,Hoofdstuk4,Paragraaf6,Artikel4.20,Lid4,Onderdeela,,de taken en de organisatie van het dienstonderdeel van een ministerie dat belast is met financieel-economische aangelegenheden;,01-01-2018,jci1.3:c:BWBR0039429&hoofdstuk=4&paragraaf=6&artikel=4.20&lid=4&o=a&z=2020-01-01&g=2020-01-01
352,Hoofdstuk4,Paragraaf6,Artikel4.20,Lid4,Onderdeelb,,"de taken, de organisatie en de kwaliteitsbeheersing van de Auditdienst Rijk.",01-01-2018,jci1.3:c:BWBR0039429&hoofdstuk=4&paragraaf=6&artikel=4.20&lid=4&o=b&z=2020-01-01&g=2020-01-01
353,Hoofdstuk4,Paragraaf6,Artikel4.20,Lid5,,,Onze Minister van Binnenlandse Zaken en Koninkrijksrelaties kan voor het Rijk regels stellen over:,01-01-2018,jci1.3:c:BWBR0039429&hoofdstuk=4&paragraaf=6&artikel=4.20&lid=5&z=2020-01-01&g=2020-01-01
354,Hoofdstuk4,Paragraaf6,Artikel4.20,Lid5,Onderdeela,,het materieelbeheer voor zover dat betrekking heeft op de onroerende zaken van het Rijk en de administraties die ten behoeve van dat materieelbeheer worden bijgehouden;,01-01-2018,jci1.3:c:BWBR0039429&hoofdstuk=4&paragraaf=6&artikel=4.20&lid=5&o=a&z=2020-01-01&g=2020-01-01
355,Hoofdstuk4,Paragraaf6,Artikel4.20,Lid5,Onderdeelb,,het privaatrechtelijk beheer van de onroerende zaken van het Rijk.,01-01-2018,jci1.3:c:BWBR0039429&hoofdstuk=4&paragraaf=6&artikel=4.20&lid=5&o=b&z=2020-01-01&g=2020-01-01
356,Hoofdstuk5,Paragraaf1,Artikel5.1,Lid1,,,Onze Minister van Financin wijst op grond van het bepaalde in dit hoofdstuk in overeenstemming met Onze Minister die het aangaat aan:,01-01-2018,jci1.3:c:BWBR0039429&hoofdstuk=5&paragraaf=1&artikel=5.1&lid=1&z=2020-01-01&g=2020-01-01
357,Hoofdstuk5,Paragraaf1,Artikel5.1,Lid1,Onderdeela,,"de rechtspersonen die schatkistbankieren, bedoeld in de , en ;artikelen 5.2, eerste en derde lid",01-01-2018,jci1.3:c:BWBR0039429&hoofdstuk=5&paragraaf=1&artikel=5.1&lid=1&o=a&z=2020-01-01&g=2020-01-01
358,Hoofdstuk5,Paragraaf1,Artikel5.1,Lid1,Onderdeelb,,"de rechtspersonen die hun liquide middelen uitzetten, bedoeld in .artikel 5.7",01-01-2018,jci1.3:c:BWBR0039429&hoofdstuk=5&paragraaf=1&artikel=5.1&lid=1&o=b&z=2020-01-01&g=2020-01-01
359,Hoofdstuk5,Paragraaf1,Artikel5.1,Lid2,,,"Onze Minister van Financin maakt de aanwijzing, bedoeld in het eerste lid, openbaar. De aanwijzing is een besluit als bedoeld in .artikel 1:3, eerste lid, van de Algemene wet bestuursrecht",01-01-2018,jci1.3:c:BWBR0039429&hoofdstuk=5&paragraaf=1&artikel=5.1&lid=2&z=2020-01-01&g=2020-01-01
360,Hoofdstuk5,Paragraaf2,Artikel5.2,Lid1,,,"Een rechtspersoon met een wettelijke taak is gehouden om te schatkistbankieren, met uitzondering van de rechtspersonen met een wettelijke taak, bedoeld in het tweede lid.",01-01-2018,jci1.3:c:BWBR0039429&hoofdstuk=5&paragraaf=2&artikel=5.2&lid=1&z=2020-01-01&g=2020-01-01
361,Hoofdstuk5,Paragraaf2,Artikel5.2,Lid2,,,"Een rechtspersoon met een wettelijke taak is niet gehouden om te schatkistbankieren, indien:",01-01-2018,jci1.3:c:BWBR0039429&hoofdstuk=5&paragraaf=2&artikel=5.2&lid=2&z=2020-01-01&g=2020-01-01
362,Hoofdstuk5,Paragraaf2,Artikel5.2,Lid2,Onderdeela,,de bij of krachtens de wet geregelde taak overwegend een private taak is;,01-01-2018,jci1.3:c:BWBR0039429&hoofdstuk=5&paragraaf=2&artikel=5.2&lid=2&o=a&z=2020-01-01&g=2020-01-01
363,Hoofdstuk5,Paragraaf2,Artikel5.2,Lid2,Onderdeelb,,de bij of krachtens de wet geregelde taak het aantrekken van financile middelen met als doel het uitzetten daarvan bij derden omvat;,01-01-2018,jci1.3:c:BWBR0039429&hoofdstuk=5&paragraaf=2&artikel=5.2&lid=2&o=b&z=2020-01-01&g=2020-01-01
364,Hoofdstuk5,Paragraaf2,Artikel5.2,Lid2,Onderdeelc,,de bij of krachtens de wet geregelde taak in verhouding tot de andere taken die aan de rechtspersoon zijn opgedragen gering is;,01-01-2018,jci1.3:c:BWBR0039429&hoofdstuk=5&paragraaf=2&artikel=5.2&lid=2&o=c&z=2020-01-01&g=2020-01-01
365,Hoofdstuk5,Paragraaf2,Artikel5.2,Lid2,Onderdeeld,,de liquide activa of de jaarlijkse ontvangsten van de rechtspersoon onder de door Onze Minister van Financin te bepalen bedragen blijven; of,01-01-2018,jci1.3:c:BWBR0039429&hoofdstuk=5&paragraaf=2&artikel=5.2&lid=2&o=d&z=2020-01-01&g=2020-01-01
366,Hoofdstuk5,Paragraaf2,Artikel5.2,Lid2,Onderdeele,,de rechtspersoon met een wettelijke taak door Onze Minister van Financin is uitgezonderd.,01-01-2018,jci1.3:c:BWBR0039429&hoofdstuk=5&paragraaf=2&artikel=5.2&lid=2&o=e&z=2020-01-01&g=2020-01-01
367,Hoofdstuk5,Paragraaf2,Artikel5.2,Lid3,,,"Een rechtspersoon met een publieke taak is gehouden om te schatkistbankieren, indien de publieke taak van die rechtspersoon naar het oordeel van Onze Minister van Financin een risicoarm beheer van de publieke liquide middelen verlangt.",01-01-2018,jci1.3:c:BWBR0039429&hoofdstuk=5&paragraaf=2&artikel=5.2&lid=3&z=2020-01-01&g=2020-01-01
368,Hoofdstuk5,Paragraaf2,Artikel5.2,Lid4,,,"Het eerste en derde lid zijn niet van toepassing op de private, liquide middelen van de rechtspersoon met een wettelijke of publieke taak, indien die liquide middelen op een adequate wijze separaat in de jaarrekening van de rechtspersoon worden verantwoord.",01-01-2018,jci1.3:c:BWBR0039429&hoofdstuk=5&paragraaf=2&artikel=5.2&lid=4&z=2020-01-01&g=2020-01-01
369,Hoofdstuk5,Paragraaf2,Artikel5.2,Lid5,,,"Onze Minister van Financin kan op verzoek van een rechtspersoon, bedoeld in het eerste en derde lid, bepaalde publieke liquide middelen van die rechtspersoon uitzonderen van de verplichting om te schatkistbankieren, indien:",01-01-2018,jci1.3:c:BWBR0039429&hoofdstuk=5&paragraaf=2&artikel=5.2&lid=5&z=2020-01-01&g=2020-01-01
370,Hoofdstuk5,Paragraaf2,Artikel5.2,Lid5,Onderdeela,,"de rechtspersoon de noodzaak van de uitzondering voor de bedrijfsvoering voldoende aannemelijk maakt, en",01-01-2018,jci1.3:c:BWBR0039429&hoofdstuk=5&paragraaf=2&artikel=5.2&lid=5&o=a&z=2020-01-01&g=2020-01-01
371,Hoofdstuk5,Paragraaf2,Artikel5.2,Lid5,Onderdeelb,,naar het oordeel van Onze Minister van Financin geen afbreuk wordt gedaan aan een doelmatig en risicoarm beheer van liquide middelen.,01-01-2018,jci1.3:c:BWBR0039429&hoofdstuk=5&paragraaf=2&artikel=5.2&lid=5&o=b&z=2020-01-01&g=2020-01-01
372,Hoofdstuk5,Paragraaf2,Artikel5.3,,,,"Indien een subsidie ten laste van de rijksbegroting door middel van voorschotbetalingen wordt verleend, kan Onze Minister die het aangaat in overeenstemming met Onze Minister van Financin bepalen dat de subsidieontvanger, niet zijnde een natuurlijke persoon, met betrekking tot de voorschotbetalingen gehouden is om te schatkistbankieren.",01-01-2018,jci1.3:c:BWBR0039429&hoofdstuk=5&paragraaf=2&artikel=5.3&z=2020-01-01&g=2020-01-01
373,Hoofdstuk5,Paragraaf2,Artikel5.4,Lid1,,,"Een rechtspersoon die publieke liquide middelen beheert en een rechtspersoon met een wettelijke taak, bedoeld in , kan op zijn verzoek schatkistbankieren, indien een risicoarm beheer van die middelen naar het oordeel van Onze Minister van Financin wenselijk is. De rechtspersoon dient hiervoor een verzoek bij Onze Minister van Financin in.artikel 5.2, tweede lid, aanhef en onderdelen c tot en met e",01-01-2018,jci1.3:c:BWBR0039429&hoofdstuk=5&paragraaf=2&artikel=5.4&lid=1&z=2020-01-01&g=2020-01-01
374,Hoofdstuk5,Paragraaf2,Artikel5.4,Lid2,,,"Het eerste lid is niet van toepassing op de private, liquide middelen van de rechtspersoon, bedoeld in het eerste lid, indien die liquide middelen op een adequate wijze separaat in de jaarrekening van de rechtspersoon worden verantwoord.",01-01-2018,jci1.3:c:BWBR0039429&hoofdstuk=5&paragraaf=2&artikel=5.4&lid=2&z=2020-01-01&g=2020-01-01
375,Hoofdstuk5,Paragraaf3,Artikel5.5,Lid1,,,"Onverminderd het elders bij of krachtens de wet bepaalde kan Onze Minister van Financin in overeenstemming met Onze Minister die het aangaat aan een rechtspersoon als bedoeld in , een lening of een rekening-courantkrediet ten laste van de begroting van Nationale Schuld verstrekken.artikel 5.2, eerste en derde lid",01-01-2018,jci1.3:c:BWBR0039429&hoofdstuk=5&paragraaf=3&artikel=5.5&lid=1&z=2020-01-01&g=2020-01-01
376,Hoofdstuk5,Paragraaf3,Artikel5.5,Lid2,,,"Een lening wordt verstrekt voor het financieren van investeringen in vaste activa, die benodigd zijn voor het uitvoeren van de wettelijke of publieke taak van de rechtspersoon.",01-01-2018,jci1.3:c:BWBR0039429&hoofdstuk=5&paragraaf=3&artikel=5.5&lid=2&z=2020-01-01&g=2020-01-01
377,Hoofdstuk5,Paragraaf3,Artikel5.5,Lid3,,,Een rekening-courantkrediet wordt verstrekt voor het overbruggen van een tijdelijk liquiditeitstekort van de rechtspersoon.,01-01-2018,jci1.3:c:BWBR0039429&hoofdstuk=5&paragraaf=3&artikel=5.5&lid=3&z=2020-01-01&g=2020-01-01
378,Hoofdstuk5,Paragraaf3,Artikel5.5,Lid4,,,"Indien in enig jaar een rechtspersoon waaraan een lening of een rekening-courant krachtens het eerste lid is verstrekt in gebreke blijft de daaruit voortvloeiende verplichtingen tot het betalen van rente of aflossing na te komen, kan Onze Minister van Financin het bedrag van die verplichtingen ten laste van de departementale begroting van Onze Minister die het aangaat overboeken naar de begroting van Nationale Schuld.",01-01-2018,jci1.3:c:BWBR0039429&hoofdstuk=5&paragraaf=3&artikel=5.5&lid=4&z=2020-01-01&g=2020-01-01
379,Hoofdstuk5,Paragraaf3,Artikel5.5,Lid5,,,"In afwijking van het vierde lid kan Onze Minister van Financin het bedrag van de verplichtingen tot het betalen van rente of aflossing naar een andere begroting overboeken, indien Onze Minister die verantwoordelijk is voor het beheer van de andere begroting daarmee instemt.",01-01-2018,jci1.3:c:BWBR0039429&hoofdstuk=5&paragraaf=3&artikel=5.5&lid=5&z=2020-01-01&g=2020-01-01
380,Hoofdstuk5,Paragraaf3,Artikel5.6,Lid1,,,"Onze Minister van Financin kan in overeenstemming met Onze Minister die het aangaat aan een rechtspersoon als bedoeld in , een lening of een rekening-courantkrediet ten laste van de begroting van Nationale Schuld verstrekken.artikel 5.4",01-01-2018,jci1.3:c:BWBR0039429&hoofdstuk=5&paragraaf=3&artikel=5.6&lid=1&z=2020-01-01&g=2020-01-01
381,Hoofdstuk5,Paragraaf3,Artikel5.6,Lid2,,,", is van overeenkomstige toepassing.Artikel 5.5, tweede tot en met vijfde lid",01-01-2018,jci1.3:c:BWBR0039429&hoofdstuk=5&paragraaf=3&artikel=5.6&lid=2&z=2020-01-01&g=2020-01-01
382,Hoofdstuk5,Paragraaf4,Artikel5.7,Lid1,,,"Een rechtspersoon met een wettelijke taak als bedoeld in , is gehouden om zijn liquide middelen uit te zetten in de vorm van producten die voldoen aan door Onze Minister van Financin te stellen eisen.artikel 5.2, tweede lid, aanhef en onder d en e",01-01-2018,jci1.3:c:BWBR0039429&hoofdstuk=5&paragraaf=4&artikel=5.7&lid=1&z=2020-01-01&g=2020-01-01
383,Hoofdstuk5,Paragraaf4,Artikel5.7,Lid2,,,"Het eerste lid is niet van toepassing op de private, liquide middelen van een rechtspersoon met een wettelijke taak, indien die liquide middelen op een adequate wijze separaat in de jaarrekening van de rechtspersoon worden verantwoord.",01-01-2018,jci1.3:c:BWBR0039429&hoofdstuk=5&paragraaf=4&artikel=5.7&lid=2&z=2020-01-01&g=2020-01-01
384,Hoofdstuk5,Paragraaf4,Artikel5.7,Lid3,,,Dit artikel is niet van toepassing op de rechtspersonen met een wettelijke taak waarvoor door Onze Minister die het aangaat regels over het uitzetten van liquide middelen zijn gesteld.,01-01-2018,jci1.3:c:BWBR0039429&hoofdstuk=5&paragraaf=4&artikel=5.7&lid=3&z=2020-01-01&g=2020-01-01
385,Hoofdstuk5,Paragraaf4,Artikel5.8,Lid1,,,"Het aantrekken van financile middelen door de rechtspersonen, bedoeld in de ,  en , met als doel door het uitzetten ervan additionele financile middelen te verwerven, is verboden.artikelen 5.2, eerste en derde lid",01-01-2018,jci1.3:c:BWBR0039429&hoofdstuk=5&paragraaf=4&artikel=5.8&lid=1&z=2020-01-01&g=2020-01-01
386,Hoofdstuk5,Paragraaf4,Artikel5.8,Lid2,,,"Het eerste lid is niet van toepassing op de private, liquide middelen van een rechtspersoon, indien die liquide middelen op een adequate wijze separaat in de jaarrekening van de rechtspersoon worden verantwoord.",01-01-2018,jci1.3:c:BWBR0039429&hoofdstuk=5&paragraaf=4&artikel=5.8&lid=2&z=2020-01-01&g=2020-01-01
387,Hoofdstuk5,Paragraaf5,Artikel5.9,,,,Onze Minister van Financin kan nadere regels stellen over het bepaalde in de .artikelen 5.1 tot en met 5.8,01-01-2018,jci1.3:c:BWBR0039429&hoofdstuk=5&paragraaf=5&artikel=5.9&z=2020-01-01&g=2020-01-01
388,Hoofdstuk6,Paragraaf1,Artikel6.1,,,,"Onverminderd het elders bij wet of EU-verordening bepaalde, houdt Onze Minister die het aangaat, toezicht op:",01-01-2018,jci1.3:c:BWBR0039429&hoofdstuk=6&paragraaf=1&artikel=6.1&z=2020-01-01&g=2020-01-01
389,Hoofdstuk6,Paragraaf1,Artikel6.1,Onderdeela,,,"rechtspersonen, commanditaire vennootschappen, vennootschappen onder firma en natuurlijke personen die een beroep of bedrijf uitoefenen die direct, indirect of voorwaardelijk:",01-01-2018,jci1.3:c:BWBR0039429&hoofdstuk=6&paragraaf=1&artikel=6.1&o=a&z=2020-01-01&g=2020-01-01
390,Hoofdstuk6,Paragraaf1,Artikel6.1,Onderdeela,Onderdeel1,,"een subsidie, lening, garantie of een bijdrage in natura met kenmerken van een subsidie, lening of garantie ten laste van de rijksbegroting hebben ontvangen;",01-01-2018,jci1.3:c:BWBR0039429&hoofdstuk=6&paragraaf=1&artikel=6.1&o=a&o=1&z=2020-01-01&g=2020-01-01
391,Hoofdstuk6,Paragraaf1,Artikel6.1,Onderdeela,Onderdeel2,,"een fiscale tegemoetkoming inzake speur- en ontwikkelingswerk, een energie-investering, een milieu-investering of een investering in huurwoningen hebben ontvangen ten behoeve waarvan door Onze Minister die het aangaat een verklaring is afgegeven of een aanwijzing bij ministerile regeling heeft plaatsgevonden;",01-01-2018,jci1.3:c:BWBR0039429&hoofdstuk=6&paragraaf=1&artikel=6.1&o=a&o=2&z=2020-01-01&g=2020-01-01
392,Hoofdstuk6,Paragraaf1,Artikel6.1,Onderdeelb,,,"rechtspersonen, commanditaire vennootschappen, vennootschappen onder firma en natuurlijke personen die een beroep of bedrijf uitoefenen en die direct, indirect of voorwaardelijk een subsidie, lening of garantie ten laste van de EU-begroting hebben ontvangen, voor zover aan de lidstaat van de Europese Unie het toezicht op en de controle van die subsidie, lening of garantie en het beheer daarvan is opgelegd;",01-01-2018,jci1.3:c:BWBR0039429&hoofdstuk=6&paragraaf=1&artikel=6.1&o=b&z=2020-01-01&g=2020-01-01
393,Hoofdstuk6,Paragraaf1,Artikel6.1,Onderdeelc,,,rechtspersonen met een wettelijke taak.,01-01-2018,jci1.3:c:BWBR0039429&hoofdstuk=6&paragraaf=1&artikel=6.1&o=c&z=2020-01-01&g=2020-01-01
394,Hoofdstuk6,Paragraaf1,Artikel6.2,,,,"Het toezicht, bedoeld in , is gericht op:artikel 6.1",01-01-2018,jci1.3:c:BWBR0039429&hoofdstuk=6&paragraaf=1&artikel=6.2&z=2020-01-01&g=2020-01-01
395,Hoofdstuk6,Paragraaf1,Artikel6.2,Onderdeela,,,"de naleving van de voorwaarden die aan het beheer en de verantwoording van de subsidie, lening, garantie, bijdrage in natura of de fiscale tegemoetkoming worden gesteld door de rechtspersonen, commanditaire vennootschappen, vennootschappen onder firma en natuurlijke personen, bedoeld in ;artikel 6.1, onder a",01-01-2018,jci1.3:c:BWBR0039429&hoofdstuk=6&paragraaf=1&artikel=6.2&o=a&z=2020-01-01&g=2020-01-01
396,Hoofdstuk6,Paragraaf1,Artikel6.2,Onderdeelb,,,"de nakoming van de verplichting die aan de lidstaat van de Europese Unie is opgelegd door de rechtspersonen, commanditaire vennootschappen, vennootschappen onder firma en natuurlijke personen, bedoeld in ;artikel 6.1, onder b",01-01-2018,jci1.3:c:BWBR0039429&hoofdstuk=6&paragraaf=1&artikel=6.2&o=b&z=2020-01-01&g=2020-01-01
397,Hoofdstuk6,Paragraaf1,Artikel6.2,Onderdeelc,,,de doelmatige en doeltreffende uitvoering van de wettelijke taak en de naleving van de voorwaarden die bij of krachtens de wet aan het beheer van de publieke financile middelen worden gesteld door rechtspersonen met een wettelijke taak.,01-01-2018,jci1.3:c:BWBR0039429&hoofdstuk=6&paragraaf=1&artikel=6.2&o=c&z=2020-01-01&g=2020-01-01
398,Hoofdstuk6,Paragraaf1,Artikel6.3,Lid1,,,"De rechtspersonen, commanditaire vennootschappen, vennootschappen onder firma en natuurlijke personen, bedoeld in , zijn gehouden op verzoek van Onze Minister die het aangaat, de volgende informatie te verstrekken:artikel 6.1, onderdeel a tot en met c",01-01-2018,jci1.3:c:BWBR0039429&hoofdstuk=6&paragraaf=1&artikel=6.3&lid=1&z=2020-01-01&g=2020-01-01
399,Hoofdstuk6,Paragraaf1,Artikel6.3,Lid1,Onderdeela,,"de jaarrekeningen, jaarverslagen en de aan de jaarrekeningen en jaarverslagen toegevoegde overige gegevens;",01-01-2018,jci1.3:c:BWBR0039429&hoofdstuk=6&paragraaf=1&artikel=6.3&lid=1&o=a&z=2020-01-01&g=2020-01-01
400,Hoofdstuk6,Paragraaf1,Artikel6.3,Lid1,Onderdeelb,,"de verantwoordingen, gegevens en documenten die nodig zijn voor de definitieve vaststelling van de subsidie, lening, garantie of bijdrage in natura met kenmerken van een subsidie, lening of garantie;",01-01-2018,jci1.3:c:BWBR0039429&hoofdstuk=6&paragraaf=1&artikel=6.3&lid=1&o=b&z=2020-01-01&g=2020-01-01
401,Hoofdstuk6,Paragraaf1,Artikel6.3,Lid1,Onderdeelc,,"de verslagen van de onderzoeken van de accountants die de bescheiden, bedoeld onder a en b, hebben gecontroleerd;",01-01-2018,jci1.3:c:BWBR0039429&hoofdstuk=6&paragraaf=1&artikel=6.3&lid=1&o=c&z=2020-01-01&g=2020-01-01
402,Hoofdstuk6,Paragraaf1,Artikel6.3,Lid1,Onderdeeld,,nadere informatie die Onze Minister die het aangaat nodig acht.,01-01-2018,jci1.3:c:BWBR0039429&hoofdstuk=6&paragraaf=1&artikel=6.3&lid=1&o=d&z=2020-01-01&g=2020-01-01
403,Hoofdstuk6,Paragraaf1,Artikel6.3,Lid2,,,"Indien de informatie, bedoeld in het eerste lid, naar het oordeel van Onze Minister die het aangaat daartoe aanleiding geeft, is Onze Minister bevoegd bij de rechtspersonen, commanditaire vennootschappen, vennootschappen onder firma en natuurlijke personen, bedoeld in , nadere inlichtingen in te winnen of overlegging van stukken te vorderen.artikel 6.1, onder a tot en met c",01-01-2018,jci1.3:c:BWBR0039429&hoofdstuk=6&paragraaf=1&artikel=6.3&lid=2&z=2020-01-01&g=2020-01-01
404,Hoofdstuk6,Paragraaf1,Artikel6.3,Lid3,,,"Onze Minister die het aangaat kan aan de hand van de administratie een onderzoek instellen bij de rechtspersonen, commanditaire vennootschappen, vennootschappen onder firma en natuurlijke personen, bedoeld in .artikel 6.1, onder a tot en met c",01-01-2018,jci1.3:c:BWBR0039429&hoofdstuk=6&paragraaf=1&artikel=6.3&lid=3&z=2020-01-01&g=2020-01-01
405,Hoofdstuk6,Paragraaf1,Artikel6.3,Lid4,,,"Onze Minister die het aangaat is bevoegd, voor zover hij dat nodig acht voor het uitoefenen van het toezicht, bedoeld in , bij alle onderdelen van de rechtspersonen, commanditaire vennootschappen, vennootschappen onder firma en natuurlijke personen, bedoeld in artikel 6.1, onder a tot en met c, alle goederen, administraties, documenten en andere informatiedragers op door hem aan te geven wijze te onderzoeken.artikel 6.1",01-01-2018,jci1.3:c:BWBR0039429&hoofdstuk=6&paragraaf=1&artikel=6.3&lid=4&z=2020-01-01&g=2020-01-01
406,Hoofdstuk6,Paragraaf1,Artikel6.3,Lid5,,,"Onze Minister die het aangaat is bevoegd inzage te vorderen in de controleprogrammas en dossiers van de accountant die de bescheiden, bedoeld in het eerste lid, onder a en b, heeft gecontroleerd om te beoordelen of in het kader van het toezicht, bedoeld in , kan worden gesteund op de controle die deze accountant heeft uitgevoerd. De accountant kan inzage in de controledossiers niet weigeren met een beroep op een bij of krachtens de wet opgelegde verplichting tot geheimhouding van vertrouwelijke gegevens die in de controledossiers zijn opgenomen.artikel 6.1",01-01-2018,jci1.3:c:BWBR0039429&hoofdstuk=6&paragraaf=1&artikel=6.3&lid=5&z=2020-01-01&g=2020-01-01
407,Hoofdstuk6,Paragraaf1,Artikel6.3,Lid6,,,"De bevoegdheden, bedoeld in , worden uitgeoefend onder verantwoordelijkheid van een registeraccountant of een accountant-administratieconsulent ten aanzien van wie in het accountantsregister een aantekening is geplaatst als bedoeld in .artikel 6.3, vierde lidartikel 36, tweede lid, onderdeel i, van de Wet op het accountantsberoep",01-01-2018,jci1.3:c:BWBR0039429&hoofdstuk=6&paragraaf=1&artikel=6.3&lid=6&z=2020-01-01&g=2020-01-01
408,Hoofdstuk6,Paragraaf1,Artikel6.3,Lid7,,,"Indien Onze Minister die het aangaat gebruik maakt van de bevoegdheden, bedoeld in het eerste tot en met vijfde lid, zijn de , ,  en  van overeenkomstige toepassing.artikelen 5:12",01-01-2018,jci1.3:c:BWBR0039429&hoofdstuk=6&paragraaf=1&artikel=6.3&lid=7&z=2020-01-01&g=2020-01-01
409,Hoofdstuk6,Paragraaf1,Artikel6.3,Lid8,,,"Onze Minister die het aangaat kan de bevoegdheden, bedoeld in het eerste tot en met het vijfde lid, uitoefenen zolang als en over de jaren dat het Rijk daarbij belang heeft.",01-01-2018,jci1.3:c:BWBR0039429&hoofdstuk=6&paragraaf=1&artikel=6.3&lid=8&z=2020-01-01&g=2020-01-01
410,Hoofdstuk6,Paragraaf1,Artikel6.3,Lid9,,,"Onverminderd het elders bij of krachtens de wet bepaalde, stelt Onze Minister die het aangaat, in afwijking van het tweede lid, geen onderzoek in ten aanzien van provincies, gemeenten, waterschappen, de openbare lichamen Bonaire, Sint Eustatius en Saba, openbare lichamen voor beroep en bedrijf en openbare lichamen en gemeenschappelijke organen ingesteld krachtens de Wet gemeenschappelijke regelingen met uitzondering van de openbare lichamen en gemeenschappelijke organen waaraan vanwege het Rijk wordt deelgenomen, voor zover zij een bijdrage als bedoeld in , hebben ontvangen.artikel 6.1, aanhef en onderdeel a",01-01-2018,jci1.3:c:BWBR0039429&hoofdstuk=6&paragraaf=1&artikel=6.3&lid=9&z=2020-01-01&g=2020-01-01
411,Hoofdstuk6,Paragraaf1,Artikel6.4,,,,"Indien een administratie of de daarmee samenhangende taken aan een derde worden uitbesteed, dan is Onze Minister die het aangaat bevoegd aan de hand van de administratie bij die derde of degene die de administratie of de taken in opdracht van die derde uitvoert een onderzoek als bedoeld in , te verrichten.artikel 6.3, derde lid",01-01-2018,jci1.3:c:BWBR0039429&hoofdstuk=6&paragraaf=1&artikel=6.4&z=2020-01-01&g=2020-01-01
412,Hoofdstuk6,Paragraaf1,Artikel6.5,,,,"De accountant die op grond van de , inzage in de controledossiers verleent en kopien hieruit verstrekt, is niet aansprakelijk voor de schade die een derde dientengevolge lijdt, tenzij aannemelijk wordt gemaakt dat de accountant gelet op alle feiten en omstandigheden hiertoe in redelijkheid niet had mogen overgaan.artikelen 6.3, vijfde lid",01-01-2018,jci1.3:c:BWBR0039429&hoofdstuk=6&paragraaf=1&artikel=6.5&z=2020-01-01&g=2020-01-01
413,Hoofdstuk6,Paragraaf1,Artikel6.6,,,,"Onverminderd het elders bij wet bepaalde, kunnen bij of krachtens algemene maatregel van bestuur regels worden gesteld over:",01-01-2018,jci1.3:c:BWBR0039429&hoofdstuk=6&paragraaf=1&artikel=6.6&z=2020-01-01&g=2020-01-01
414,Hoofdstuk6,Paragraaf1,Artikel6.6,Onderdeela,,,de informatie die de rechtspersonen met een wettelijke taak in hun begroting en jaarverslag opnemen;,01-01-2018,jci1.3:c:BWBR0039429&hoofdstuk=6&paragraaf=1&artikel=6.6&o=a&z=2020-01-01&g=2020-01-01
415,Hoofdstuk6,Paragraaf1,Artikel6.6,Onderdeelb,,,de eisen aan de informatie die in het jaarverslag van de rechtspersonen met een wettelijke taak wordt opgenomen.,01-01-2018,jci1.3:c:BWBR0039429&hoofdstuk=6&paragraaf=1&artikel=6.6&o=b&z=2020-01-01&g=2020-01-01
