,Nummer,Lid,Opsomming niveau 1,Opsomming niveau 2,Opsomming niveau 3,Zin,Brontekst,Versie,jci 1.3
416,Hoofdstuk6,Paragraaf2,Artikel6.7,Lid1,,,Onze Minister die het aangaat is belast met het toezicht op:,01-01-2018,jci1.3:c:BWBR0039429&hoofdstuk=6&paragraaf=2&artikel=6.7&lid=1&z=2020-01-01&g=2020-01-01
417,Hoofdstuk6,Paragraaf2,Artikel6.7,Lid1,Onderdeela,,"het schatkistbankieren door de rechtspersonen die krachtens , zijn aangewezen;artikel 5.1, eerste lid, aanhef en onder a",01-01-2018,jci1.3:c:BWBR0039429&hoofdstuk=6&paragraaf=2&artikel=6.7&lid=1&o=a&z=2020-01-01&g=2020-01-01
418,Hoofdstuk6,Paragraaf2,Artikel6.7,Lid1,Onderdeelb,,"het uitzetten van de liquide middelen door de rechtspersonen die krachtens , zijn aangewezen;artikel 5.1, eerste lid, aanhef en onder b",01-01-2018,jci1.3:c:BWBR0039429&hoofdstuk=6&paragraaf=2&artikel=6.7&lid=1&o=b&z=2020-01-01&g=2020-01-01
419,Hoofdstuk6,Paragraaf2,Artikel6.7,Lid1,Onderdeelc,,het in  bepaalde.artikel 5.8,01-01-2018,jci1.3:c:BWBR0039429&hoofdstuk=6&paragraaf=2&artikel=6.7&lid=1&o=c&z=2020-01-01&g=2020-01-01
420,Hoofdstuk6,Paragraaf2,Artikel6.7,Lid2,,,"Een rechtspersoon die krachtens , is aangewezen verstrekt op verzoek van Onze Minister die het aangaat de informatie die hij voor zijn toezicht, bedoeld in het eerste lid, nodig acht.artikel 5.1, eerste lid, aanhef en onder a en b",01-01-2018,jci1.3:c:BWBR0039429&hoofdstuk=6&paragraaf=2&artikel=6.7&lid=2&z=2020-01-01&g=2020-01-01
421,Hoofdstuk6,Paragraaf2,Artikel6.7,Lid3,,,"De rechtspersonen die krachtens , zijn aangewezen, verrichten op verzoek van Onze Minister die het aangaat een onderzoek naar de naleving van de verplichtingen, bedoeld de  en  en . Het onderzoek wordt verricht door de accountant die belast is met de controle van de jaarrekening van die rechtspersoon. De rechtspersonen sturen het verslag van het onderzoek naar Onze Minister die het aangaat.artikel 5.1, eerste lid, aanhef en onder a en b",01-01-2018,jci1.3:c:BWBR0039429&hoofdstuk=6&paragraaf=2&artikel=6.7&lid=3&z=2020-01-01&g=2020-01-01
422,Hoofdstuk6,Paragraaf2,Artikel6.7,Lid4,,,"Onze Minister die het aangaat kan een rechtspersoon die krachtens , is aangewezen en die zich niet houdt aan het bij of krachtens de  en  en  bepaalde, de aanwijzing geven hieraan alsnog te voldoen.artikel 5.1, eerste lid, aanhef en onder a en b",01-01-2018,jci1.3:c:BWBR0039429&hoofdstuk=6&paragraaf=2&artikel=6.7&lid=4&z=2020-01-01&g=2020-01-01
423,Hoofdstuk6,Paragraaf2,Artikel6.8,,,,"Onze Minister van Financin kan nadere regels stellen over het toezicht, bedoeld in .artikel 6.7",01-01-2018,jci1.3:c:BWBR0039429&hoofdstuk=6&paragraaf=2&artikel=6.8&z=2020-01-01&g=2020-01-01
424,Hoofdstuk6,Paragraaf3,Artikel6.9,Lid1,,,Onze Minister van Financin kan in overeenstemming met Onze Ministers die het mede aangaan jaarlijks ten behoeve van de Europese Commissie een verklaring opstellen over de besteding van de Europese middelen in gedeeld beheer door de lidstaat Nederland.,01-01-2018,jci1.3:c:BWBR0039429&hoofdstuk=6&paragraaf=3&artikel=6.9&lid=1&z=2020-01-01&g=2020-01-01
425,Hoofdstuk6,Paragraaf3,Artikel6.9,Lid2,,,Onze Minister van Financin zendt de verklaring naar de Europese Commissie.,01-01-2018,jci1.3:c:BWBR0039429&hoofdstuk=6&paragraaf=3&artikel=6.9&lid=2&z=2020-01-01&g=2020-01-01
426,Hoofdstuk6,Paragraaf3,Artikel6.9,Lid3,,,Onze Minister van Financin zendt de verklaring voor onderzoek naar de Algemene Rekenkamer.,01-01-2018,jci1.3:c:BWBR0039429&hoofdstuk=6&paragraaf=3&artikel=6.9&lid=3&z=2020-01-01&g=2020-01-01
427,Hoofdstuk6,Paragraaf3,Artikel6.9,Lid4,,,Onze Minister van Financin zendt de verklaring na het onderzoek van de Algemene Rekenkamer naar de Tweede Kamer der Staten-Generaal.,01-01-2018,jci1.3:c:BWBR0039429&hoofdstuk=6&paragraaf=3&artikel=6.9&lid=4&z=2020-01-01&g=2020-01-01
428,Hoofdstuk7,Paragraaf1,Artikel7.1,Lid1,,,"De Algemene Rekenkamer bestaat uit drie leden in gewone dienst die tezamen het college van de Algemene Rekenkamer vormen, alsmede uit ten hoogste drie leden in buitengewone dienst.",01-01-2018,jci1.3:c:BWBR0039429&hoofdstuk=7&paragraaf=1&artikel=7.1&lid=1&z=2020-01-01&g=2020-01-01
429,Hoofdstuk7,Paragraaf1,Artikel7.1,Lid2,,,De president wordt uit de leden in gewone dienst bij koninklijk besluit op voordracht van Onze Minister van Binnenlandse Zaken en Koninkrijksrelaties benoemd.,01-01-2018,jci1.3:c:BWBR0039429&hoofdstuk=7&paragraaf=1&artikel=7.1&lid=2&z=2020-01-01&g=2020-01-01
430,Hoofdstuk7,Paragraaf1,Artikel7.1,Lid3,,,De Algemene Rekenkamer stelt Ons en de Tweede Kamer der Staten-Generaal zo spoedig mogelijk in kennis van een vacature onder de leden.,01-01-2018,jci1.3:c:BWBR0039429&hoofdstuk=7&paragraaf=1&artikel=7.1&lid=3&z=2020-01-01&g=2020-01-01
431,Hoofdstuk7,Paragraaf1,Artikel7.1,Lid4,,,"Het college van de Algemene Rekenkamer stelt een aanbevelingslijst op met ten minste vier kandidaten en zendt deze zo spoedig mogelijk na de kennisgeving van de vacature, bedoeld in het derde lid, naar de Tweede Kamer der Staten-Generaal. De Tweede Kamer der Staten-Generaal zal bij haar voordracht op de aanbevelingslijst zodanig acht slaan als haar dienstig voorkomt.",01-01-2018,jci1.3:c:BWBR0039429&hoofdstuk=7&paragraaf=1&artikel=7.1&lid=4&z=2020-01-01&g=2020-01-01
432,Hoofdstuk7,Paragraaf1,Artikel7.2,Lid1,,,De leden in buitengewone dienst kunnen door de president worden opgeroepen om deel te nemen aan bepaalde werkzaamheden en hebben met betrekking tot die werkzaamheden dezelfde bevoegdheden als de leden in gewone dienst. De leden in buitengewone dienst maken dan tevens deel uit van het college van de Algemene Rekenkamer.,01-01-2018,jci1.3:c:BWBR0039429&hoofdstuk=7&paragraaf=1&artikel=7.2&lid=1&z=2020-01-01&g=2020-01-01
433,Hoofdstuk7,Paragraaf1,Artikel7.2,Lid2,,,Een lid in buitengewone dienst vervangt een lid in gewone dienst gedurende diens voorziene afwezigheid of ontstentenis.,01-01-2018,jci1.3:c:BWBR0039429&hoofdstuk=7&paragraaf=1&artikel=7.2&lid=2&z=2020-01-01&g=2020-01-01
434,Hoofdstuk7,Paragraaf1,Artikel7.3,Lid1,,,De Algemene Rekenkamer heeft een secretaris.,01-01-2020,jci1.3:c:BWBR0039429&hoofdstuk=7&paragraaf=1&artikel=7.3&lid=1&z=2020-01-01&g=2020-01-01
435,Hoofdstuk7,Paragraaf1,Artikel7.3,Lid2,,,"Op voordracht van de Algemene Rekenkamer wordt bij koninklijk besluit besloten tot het aangaan van een arbeidsovereenkomst met de secretaris. Tot beindiging van de arbeidsovereenkomst wordt bij koninklijk besluit op voordracht van de Algemene Rekenkamer besloten, tenzij de Algemene Rekenkamer de arbeidsovereenkomst opzegt op grond van .artikel 677 van Boek 7 van het Burgerlijk Wetboek",01-01-2020,jci1.3:c:BWBR0039429&hoofdstuk=7&paragraaf=1&artikel=7.3&lid=2&z=2020-01-01&g=2020-01-01
436,Hoofdstuk7,Paragraaf1,Artikel7.4,Lid1,,,"Om tot lid van de Algemene Rekenkamer te kunnen worden benoemd, moet men Nederlander zijn.",01-01-2018,jci1.3:c:BWBR0039429&hoofdstuk=7&paragraaf=1&artikel=7.4&lid=1&z=2020-01-01&g=2020-01-01
437,Hoofdstuk7,Paragraaf1,Artikel7.4,Lid2,,,"De leden en de secretaris vervullen geen andere openbare betrekkingen waaraan een vaste beloning of toelage is verbonden, noch zijn zij lid van een publiekrechtelijk college waarvoor de keuze geschiedt bij of krachtens wettelijk voorschrift uitgeschreven verkiezingen. Hiervan kan bij koninklijk besluit, de Algemene Rekenkamer gehoord, ontheffing worden verleend, tenzij de onverenigbaarheid ook uit een ander wettelijk voorschrift voortvloeit.",01-01-2018,jci1.3:c:BWBR0039429&hoofdstuk=7&paragraaf=1&artikel=7.4&lid=2&z=2020-01-01&g=2020-01-01
438,Hoofdstuk7,Paragraaf1,Artikel7.4,Lid3,,,"Onverminderd het tweede lid, vervullen de leden en de secretaris geen betrekkingen die ongewenst zijn met het oog op een goede vervulling van hun ambt of handhaving van hun onpartijdigheid en onafhankelijkheid of van het vertrouwen daarin.",01-01-2018,jci1.3:c:BWBR0039429&hoofdstuk=7&paragraaf=1&artikel=7.4&lid=3&z=2020-01-01&g=2020-01-01
439,Hoofdstuk7,Paragraaf1,Artikel7.4,Lid4,,,"De betrekkingen die de leden en de secretaris buiten hun ambt vervullen, worden jaarlijks door de president openbaar gemaakt.",01-01-2018,jci1.3:c:BWBR0039429&hoofdstuk=7&paragraaf=1&artikel=7.4&lid=4&z=2020-01-01&g=2020-01-01
440,Hoofdstuk7,Paragraaf1,Artikel7.5,Lid1,,,Een lid wordt ontslag verleend op eigen verzoek en bij het bereiken van de leeftijd van zeventig jaar. Het ontslag gaat in op de eerste dag van de volgende maand.,01-01-2019,jci1.3:c:BWBR0039429&hoofdstuk=7&paragraaf=1&artikel=7.5&lid=1&z=2020-01-01&g=2020-01-01
441,Hoofdstuk7,Paragraaf1,Artikel7.5,Lid2,,,"De Hoge Raad der Nederlanden kan de leden ontslaan of schorsen. , met uitzondering van de , , , , ,  en , is daarbij van overeenkomstige toepassing, met dien verstande dat:Hoofdstuk 6A van de Wet rechtspositie rechterlijke ambtenaren",01-01-2019,jci1.3:c:BWBR0039429&hoofdstuk=7&paragraaf=1&artikel=7.5&lid=2&z=2020-01-01&g=2020-01-01
442,Hoofdstuk7,Paragraaf1,Artikel7.5,Lid2,Onderdeela,,de disciplinaire maatregel van schriftelijke berisping wordt opgelegd door de president van de Algemene Rekenkamer;,01-01-2019,jci1.3:c:BWBR0039429&hoofdstuk=7&paragraaf=1&artikel=7.5&lid=2&o=a&z=2020-01-01&g=2020-01-01
443,Hoofdstuk7,Paragraaf1,Artikel7.5,Lid2,Onderdeelb,,"in  voor de rechterlijk ambtenaar, tevens zijnde president van het gerechtshof of de rechtbank, de president van de Hoge Raad onderscheidenlijk procureur-generaal bij de Hoge Raad wordt gelezen de president van de Algemene Rekenkamer;artikel 46e",01-01-2019,jci1.3:c:BWBR0039429&hoofdstuk=7&paragraaf=1&artikel=7.5&lid=2&o=b&z=2020-01-01&g=2020-01-01
444,Hoofdstuk7,Paragraaf1,Artikel7.5,Lid2,Onderdeelc,,de president van de Algemene Rekenkamer als functionele autoriteit wordt aangemerkt;,01-01-2019,jci1.3:c:BWBR0039429&hoofdstuk=7&paragraaf=1&artikel=7.5&lid=2&o=c&z=2020-01-01&g=2020-01-01
445,Hoofdstuk7,Paragraaf1,Artikel7.5,Lid2,Onderdeeld,,voor Onze Minister wordt gelezen Onze Minister van Binnenlandse Zaken en Koninkrijksrelaties;,01-01-2019,jci1.3:c:BWBR0039429&hoofdstuk=7&paragraaf=1&artikel=7.5&lid=2&o=d&z=2020-01-01&g=2020-01-01
446,Hoofdstuk7,Paragraaf1,Artikel7.5,Lid2,Onderdeele,,"de voordracht, bedoeld in de , en , wordt gedaan door de Algemene Rekenkamer;artikelen 46i, vierde lid",01-01-2019,jci1.3:c:BWBR0039429&hoofdstuk=7&paragraaf=1&artikel=7.5&lid=2&o=e&z=2020-01-01&g=2020-01-01
447,Hoofdstuk7,Paragraaf1,Artikel7.5,Lid2,Onderdeelf,,"in , in plaats van het betrokken gerecht onderscheidenlijk het parket bij de Hoge Raad wordt gelezen de Algemene Rekenkamer.artikel 46p, vijfde lid",01-01-2019,jci1.3:c:BWBR0039429&hoofdstuk=7&paragraaf=1&artikel=7.5&lid=2&o=f&z=2020-01-01&g=2020-01-01
448,Hoofdstuk7,Paragraaf1,Artikel7.5,Lid3,,,"Onverminderd de gronden voor ontslag, bedoeld in het tweede lid, is een grond voor ontslag dat het lid in strijd met , handelt.artikel 7.4, derde lid",01-01-2019,jci1.3:c:BWBR0039429&hoofdstuk=7&paragraaf=1&artikel=7.5&lid=3&z=2020-01-01&g=2020-01-01
449,Hoofdstuk7,Paragraaf1,Artikel7.5,Lid4,,,Bij of krachtens algemene maatregel van bestuur kunnen regels worden gesteld met betrekking tot wachtgeld en voorzieningen in verband met ziekte en arbeidsongeschiktheid.,01-01-2019,jci1.3:c:BWBR0039429&hoofdstuk=7&paragraaf=1&artikel=7.5&lid=4&z=2020-01-01&g=2020-01-01
450,Hoofdstuk7,Paragraaf1,Artikel7.6,Lid1,,,"De president, de overige leden in gewone dienst, de leden in buitengewone dienst en de secretaris leggen, alvorens hun ambt te aanvaarden, in Onze handen de volgende eed (verklaring en belofte) af:",01-01-2018,jci1.3:c:BWBR0039429&hoofdstuk=7&paragraaf=1&artikel=7.6&lid=1&z=2020-01-01&g=2020-01-01
451,Hoofdstuk7,Paragraaf1,Artikel7.6,Lid1,Onderdeel,,"Ik zweer (verklaar) dat ik, tot het verkrijgen van mijn aanstelling, middellijk noch onmiddellijk, onder welke naam of welk voorwendsel ook, aan iemand iets heb gegeven of beloofd.",01-01-2018,jci1.3:c:BWBR0039429&hoofdstuk=7&paragraaf=1&artikel=7.6&lid=1&z=2020-01-01&g=2020-01-01
452,Hoofdstuk7,Paragraaf1,Artikel7.6,Lid1,Onderdeel,,"Ik zweer (verklaar en beloof) dat ik om iets in dit ambt te doen of te laten, van niemand enig geschenk of enige belofte heb aangenomen of zal aannemen, middellijk of onmiddellijk.",01-01-2018,jci1.3:c:BWBR0039429&hoofdstuk=7&paragraaf=1&artikel=7.6&lid=1&z=2020-01-01&g=2020-01-01
453,Hoofdstuk7,Paragraaf1,Artikel7.6,Lid1,Onderdeel,,"Ik zweer (beloof) trouw aan de Koning, dat ik de  steeds zal helpen onderhouden en mijn ambt met eerlijkheid, nauwgezetheid en onpartijdigheid zal vervullen.Grondwet",01-01-2018,jci1.3:c:BWBR0039429&hoofdstuk=7&paragraaf=1&artikel=7.6&lid=1&z=2020-01-01&g=2020-01-01
454,Hoofdstuk7,Paragraaf1,Artikel7.6,Lid1,Onderdeel,,Zo waarlijk helpe mij God almachtig! (Dat verklaar en beloof ik!).,01-01-2018,jci1.3:c:BWBR0039429&hoofdstuk=7&paragraaf=1&artikel=7.6&lid=1&z=2020-01-01&g=2020-01-01
455,Hoofdstuk7,Paragraaf1,Artikel7.6,Lid2,,,"Daartoe door Ons gemachtigd kan ook de president in een vergadering van het college van de Algemene Rekenkamer deze eed of de verklaring en belofte afnemen van de overige leden in gewone dienst, de leden in buitengewone dienst en de secretaris.",01-01-2018,jci1.3:c:BWBR0039429&hoofdstuk=7&paragraaf=1&artikel=7.6&lid=2&z=2020-01-01&g=2020-01-01
456,Hoofdstuk7,Paragraaf1,Artikel7.7,,,,De Algemene Rekenkamer stelt voor haar werkzaamheden een reglement van orde vast. Het reglement wordt in de Staatscourant geplaatst.,01-01-2018,jci1.3:c:BWBR0039429&hoofdstuk=7&paragraaf=1&artikel=7.7&z=2020-01-01&g=2020-01-01
457,Hoofdstuk7,Paragraaf1,Artikel7.8,Lid1,,,De president houdt toezicht op de werkzaamheden van de Algemene Rekenkamer en op de juiste toepassing van het bij of krachtens dit hoofdstuk bepaalde.,01-01-2018,jci1.3:c:BWBR0039429&hoofdstuk=7&paragraaf=1&artikel=7.8&lid=1&z=2020-01-01&g=2020-01-01
458,Hoofdstuk7,Paragraaf1,Artikel7.8,Lid2,,,De president brengt alle stukken die aan de Algemene Rekenkamer of aan hem in zijn hoedanigheid worden toegezonden ter behandeling in de vergadering van het college van de Algemene Rekenkamer met uitzondering van de stukken die in het reglement van orde zijn uitgezonderd.,01-01-2018,jci1.3:c:BWBR0039429&hoofdstuk=7&paragraaf=1&artikel=7.8&lid=2&z=2020-01-01&g=2020-01-01
459,Hoofdstuk7,Paragraaf1,Artikel7.8,Lid3,,,De taken en bevoegdheden van de president worden bij diens afwezigheid of ontstentenis waargenomen door het aanwezige lid in gewone dienst dat naar rang van benoeming het oudst is.,01-01-2018,jci1.3:c:BWBR0039429&hoofdstuk=7&paragraaf=1&artikel=7.8&lid=3&z=2020-01-01&g=2020-01-01
460,Hoofdstuk7,Paragraaf1,Artikel7.9,Lid1,,,Het college van de Algemene Rekenkamer besluit bij meerderheid van stemmen.,01-01-2018,jci1.3:c:BWBR0039429&hoofdstuk=7&paragraaf=1&artikel=7.9&lid=1&z=2020-01-01&g=2020-01-01
461,Hoofdstuk7,Paragraaf1,Artikel7.9,Lid2,,,"Indien de stemmen staken, beslist de stem van de president.",01-01-2018,jci1.3:c:BWBR0039429&hoofdstuk=7&paragraaf=1&artikel=7.9&lid=2&z=2020-01-01&g=2020-01-01
462,Hoofdstuk7,Paragraaf1,Artikel7.9,Lid3,,,"Het college van de Algemene Rekenkamer neemt geen besluiten, indien niet ten minste de meerderheid van het aantal leden van het college van de Algemene Rekenkamer in de vergadering aanwezig is.",01-01-2018,jci1.3:c:BWBR0039429&hoofdstuk=7&paragraaf=1&artikel=7.9&lid=3&z=2020-01-01&g=2020-01-01
463,Hoofdstuk7,Paragraaf1,Artikel7.10,Lid1,,,"De leden en de secretaris mogen niet aanwezig zijn bij de beraadslagingen en het nemen van beslissingen over enige zaak, die hen, hun echtgenoten, hun geregistreerde partners, degenen met wie zij duurzaam samenleven of hun naastbestaanden tot in de derde graad van bloedverwantschap of aanverwantschap betreffen.",01-01-2018,jci1.3:c:BWBR0039429&hoofdstuk=7&paragraaf=1&artikel=7.10&lid=1&z=2020-01-01&g=2020-01-01
464,Hoofdstuk7,Paragraaf1,Artikel7.10,Lid2,,,De leden en de secretaris nemen niet deel aan het onderzoek van en de beslissing over rekeningen en verantwoordingen die door hen worden afgelegd.,01-01-2018,jci1.3:c:BWBR0039429&hoofdstuk=7&paragraaf=1&artikel=7.10&lid=2&z=2020-01-01&g=2020-01-01
465,Hoofdstuk7,Paragraaf1,Artikel7.11,Lid1,,,"Het college van de Algemene Rekenkamer kan het aangaan, wijzigen en beindigen van de arbeidsovereenkomsten met de ambtenaren van de Algemene Rekenkamer opdragen aan de secretaris.",01-01-2020,jci1.3:c:BWBR0039429&hoofdstuk=7&paragraaf=1&artikel=7.11&lid=1&z=2020-01-01&g=2020-01-01
466,Hoofdstuk7,Paragraaf1,Artikel7.11,Lid2,,,Ten aanzien van de ambtenaren van de Algemene Rekenkamer gelden de voor alle ambtenaren geldende arbeidsvoorwaarden die zijn opgenomen in de laatstelijk afgesloten collectieve arbeidsovereenkomst voor ambtenaren die krachtens een arbeidsovereenkomst met de Staat werkzaam zijn.,01-01-2020,jci1.3:c:BWBR0039429&hoofdstuk=7&paragraaf=1&artikel=7.11&lid=2&z=2020-01-01&g=2020-01-01
467,Hoofdstuk7,Paragraaf1,Artikel7.11,Lid3,,,"Op verzoek van de Algemene Rekenkamer kunnen in de collectieve arbeidsovereenkomst, bedoeld in het tweede lid, andere arbeidsvoorwaarden voor de ambtenaren van de Algemene Rekenkamer worden opgenomen.",01-01-2020,jci1.3:c:BWBR0039429&hoofdstuk=7&paragraaf=1&artikel=7.11&lid=3&z=2020-01-01&g=2020-01-01
468,Hoofdstuk7,Paragraaf1,Artikel7.11,Lid4,,,"Van de ambtenaren van de Algemene Rekenkamer wordt door de president hetzij de eed, hetzij de verklaring en belofte afgenomen.",01-01-2020,jci1.3:c:BWBR0039429&hoofdstuk=7&paragraaf=1&artikel=7.11&lid=4&z=2020-01-01&g=2020-01-01
469,Hoofdstuk7,Paragraaf2,Artikel7.12,Lid1,,,De Algemene Rekenkamer onderzoekt met betrekking tot het Rijk jaarlijks:,01-01-2018,jci1.3:c:BWBR0039429&hoofdstuk=7&paragraaf=2&artikel=7.12&lid=1&z=2020-01-01&g=2020-01-01
470,Hoofdstuk7,Paragraaf2,Artikel7.12,Lid1,Onderdeela,,de financile verantwoordingsinformatie in de jaarverslagen;,01-01-2018,jci1.3:c:BWBR0039429&hoofdstuk=7&paragraaf=2&artikel=7.12&lid=1&o=a&z=2020-01-01&g=2020-01-01
471,Hoofdstuk7,Paragraaf2,Artikel7.12,Lid1,Onderdeelb,,de totstandkoming van de niet-financile verantwoordingsinformatie in de jaarverslagen;,01-01-2018,jci1.3:c:BWBR0039429&hoofdstuk=7&paragraaf=2&artikel=7.12&lid=1&o=b&z=2020-01-01&g=2020-01-01
472,Hoofdstuk7,Paragraaf2,Artikel7.12,Lid1,Onderdeelc,,de financile verantwoordingsinformatie in het Financieel jaarverslag van het Rijk.,01-01-2018,jci1.3:c:BWBR0039429&hoofdstuk=7&paragraaf=2&artikel=7.12&lid=1&o=c&z=2020-01-01&g=2020-01-01
473,Hoofdstuk7,Paragraaf2,Artikel7.12,Lid2,,,De Algemene Rekenkamer onderzoekt met betrekking tot het Rijk:,01-01-2018,jci1.3:c:BWBR0039429&hoofdstuk=7&paragraaf=2&artikel=7.12&lid=2&z=2020-01-01&g=2020-01-01
474,Hoofdstuk7,Paragraaf2,Artikel7.12,Lid2,Onderdeela,,"het begrotingsbeheer, het financieel beheer, de materile bedrijfsvoering en de daartoe bijgehouden administraties van het Rijk;",01-01-2018,jci1.3:c:BWBR0039429&hoofdstuk=7&paragraaf=2&artikel=7.12&lid=2&o=a&z=2020-01-01&g=2020-01-01
475,Hoofdstuk7,Paragraaf2,Artikel7.12,Lid2,Onderdeelb,,de centrale administratie van de schatkist van het Rijk van het Ministerie van Financin.,01-01-2018,jci1.3:c:BWBR0039429&hoofdstuk=7&paragraaf=2&artikel=7.12&lid=2&o=b&z=2020-01-01&g=2020-01-01
476,Hoofdstuk7,Paragraaf2,Artikel7.13,Lid1,,,"Het onderzoek, bedoeld in , is erop gericht na te gaan of voldaan is aan de normen, bedoeld in de .artikel 7.12, eerste lid",01-01-2018,jci1.3:c:BWBR0039429&hoofdstuk=7&paragraaf=2&artikel=7.13&lid=1&z=2020-01-01&g=2020-01-01
477,Hoofdstuk7,Paragraaf2,Artikel7.13,Lid2,,,"Het onderzoek, bedoeld in , is erop gericht na te gaan of voldaan is aan de normen, bedoeld in de .artikel 7.12, tweede lid",01-01-2018,jci1.3:c:BWBR0039429&hoofdstuk=7&paragraaf=2&artikel=7.13&lid=2&z=2020-01-01&g=2020-01-01
478,Hoofdstuk7,Paragraaf2,Artikel7.14,Lid1,,,"De Algemene Rekenkamer legt haar bevindingen en conclusies met betrekking tot de onderzoeken, bedoeld in , jaarlijks vast in rapporten.artikel 7.12, eerste en tweede lid",01-01-2018,jci1.3:c:BWBR0039429&hoofdstuk=7&paragraaf=2&artikel=7.14&lid=1&z=2020-01-01&g=2020-01-01
479,Hoofdstuk7,Paragraaf2,Artikel7.14,Lid2,,,"De Algemene Rekenkamer stelt een verklaring van goedkeuring op bij de in het Financieel jaarverslag van het Rijk opgenomen rijksrekening en de rijkssaldibalans, bedoeld in .artikel 2.35, tweede en vierde lid",01-01-2018,jci1.3:c:BWBR0039429&hoofdstuk=7&paragraaf=2&artikel=7.14&lid=2&z=2020-01-01&g=2020-01-01
480,Hoofdstuk7,Paragraaf2,Artikel7.14,Lid3,,,"De verklaring van goedkeuring wordt zo nodig gegeven onder voorbehoud van de vaststelling van de slotverschillen, bedoeld in , en in voorkomende gevallen een indemniteitswet als bedoeld in .artikel 2.36",01-01-2018,jci1.3:c:BWBR0039429&hoofdstuk=7&paragraaf=2&artikel=7.14&lid=3&z=2020-01-01&g=2020-01-01
481,Hoofdstuk7,Paragraaf2,Artikel7.14,Lid4,,,"Voordat de Algemene Rekenkamer een rapport, bedoeld in het eerste lid, vaststelt, stelt zij Onze Minister die het aangaat in de gelegenheid binnen een redelijke termijn te reageren op haar bevindingen en voorlopige conclusies.",01-01-2018,jci1.3:c:BWBR0039429&hoofdstuk=7&paragraaf=2&artikel=7.14&lid=4&z=2020-01-01&g=2020-01-01
482,Hoofdstuk7,Paragraaf2,Artikel7.14,Lid5,,,"Van gegevens en bevindingen die naar hun aard vertrouwelijk zijn, maakt de Algemene Rekenkamer geen melding in een rapport als bedoeld in het eerste lid. Mededelingen die zodanige gegevens of bevindingen bevatten, kan zij vertrouwelijk ter kennisneming aan de Staten-Generaal verstrekken.",01-01-2018,jci1.3:c:BWBR0039429&hoofdstuk=7&paragraaf=2&artikel=7.14&lid=5&z=2020-01-01&g=2020-01-01
483,Hoofdstuk7,Paragraaf2,Artikel7.15,Lid1,,,"De Algemene Rekenkamer biedt de rapporten en de verklaring van goedkeuring, bedoeld in , uiterlijk op 1juni van het jaar volgend op het begrotingsjaar aan de Staten-Generaal en Ons aan.artikel 7.14, eerste en tweede lid",01-01-2018,jci1.3:c:BWBR0039429&hoofdstuk=7&paragraaf=2&artikel=7.15&lid=1&z=2020-01-01&g=2020-01-01
484,Hoofdstuk7,Paragraaf2,Artikel7.15,Lid2,,,"Indien de Algemene Rekenkamer het onderzoek, bedoeld in , op 1juni van het jaar volgend op het begrotingsjaar nog niet heeft afgesloten, biedt zij op die datum een voorlopig rapport over de stand van het betrokken onderzoek. In dat geval zendt de Algemene Rekenkamer het definitieve rapport en de verklaring van goedkeuring, bedoeld in , zo spoedig mogelijk na.artikel 7.12, eerste en tweede lid",01-01-2018,jci1.3:c:BWBR0039429&hoofdstuk=7&paragraaf=2&artikel=7.15&lid=2&z=2020-01-01&g=2020-01-01
485,Hoofdstuk7,Paragraaf2,Artikel7.16,,,,De Algemene Rekenkamer onderzoekt de doeltreffendheid en de doelmatigheid van het gevoerde beleid van het Rijk.,01-01-2018,jci1.3:c:BWBR0039429&hoofdstuk=7&paragraaf=2&artikel=7.16&z=2020-01-01&g=2020-01-01
486,Hoofdstuk7,Paragraaf2,Artikel7.17,Lid1,,,"De Algemene Rekenkamer stelt de Staten-Generaal en Ons in kennis van het rapport dat zij naar aanleiding van een onderzoek, bedoeld in , vaststelt.artikel 7.16",01-01-2018,jci1.3:c:BWBR0039429&hoofdstuk=7&paragraaf=2&artikel=7.17&lid=1&z=2020-01-01&g=2020-01-01
487,Hoofdstuk7,Paragraaf2,Artikel7.17,Lid2,,,"De Algemene Rekenkamer stelt in voorkomende gevallen tevens de instelling, bedoeld in , in kennis van het rapport, bedoeld in het eerste lid.artikel 7.34, achtste lid",01-01-2018,jci1.3:c:BWBR0039429&hoofdstuk=7&paragraaf=2&artikel=7.17&lid=2&z=2020-01-01&g=2020-01-01
488,Hoofdstuk7,Paragraaf2,Artikel7.17,Lid3,,,"Voordat de Algemene Rekenkamer een rapport als bedoeld in het eerste lid, vaststelt, stelt zij Onze Minister die het aangaat in de gelegenheid binnen een redelijke termijn te reageren op haar bevindingen en voorlopige conclusies.",01-01-2018,jci1.3:c:BWBR0039429&hoofdstuk=7&paragraaf=2&artikel=7.17&lid=3&z=2020-01-01&g=2020-01-01
489,Hoofdstuk7,Paragraaf2,Artikel7.17,Lid4,,,"Van gegevens en bevindingen die naar hun aard vertrouwelijk zijn, maakt de Algemene Rekenkamer geen melding in een rapport als bedoeld in het eerste lid. Mededelingen die zodanige gegevens of bevindingen bevatten, kan zij vertrouwelijk ter kennisneming aan de Staten-Generaal verstrekken.",01-01-2018,jci1.3:c:BWBR0039429&hoofdstuk=7&paragraaf=2&artikel=7.17&lid=4&z=2020-01-01&g=2020-01-01
490,Hoofdstuk7,Paragraaf2,Artikel7.18,Lid1,,,"De Algemene Rekenkamer is bevoegd, voor zover zij dat nodig acht voor het uitvoeren van haar taken, bij alle onderdelen van het Rijk alle goederen, administraties, documenten en andere informatiedragers op door haar aan te geven wijze te onderzoeken.",01-01-2018,jci1.3:c:BWBR0039429&hoofdstuk=7&paragraaf=2&artikel=7.18&lid=1&z=2020-01-01&g=2020-01-01
491,Hoofdstuk7,Paragraaf2,Artikel7.18,Lid2,,,De Algemene Rekenkamer is bevoegd voor het uitvoeren van haar taken inzage te vorderen in de controleprogrammas en dossiers van de accountant die in opdracht van een van Onze Ministers of een college met een controle of review is belast. De Algemene Rekenkamer is bevoegd kopien te maken van de stukken uit de controledossiers. De accountant kan inzage in de controledossiers niet weigeren met een beroep op een bij of krachtens de wet opgelegde verplichting tot geheimhouding van vertrouwelijke gegevens die in de controledossiers zijn opgenomen.  is van overeenkomstige toepassing.Artikel 6.5,01-01-2018,jci1.3:c:BWBR0039429&hoofdstuk=7&paragraaf=2&artikel=7.18&lid=2&z=2020-01-01&g=2020-01-01
492,Hoofdstuk7,Paragraaf2,Artikel7.18,Lid3,,,"Bij het uitvoeren van haar taken kan de Algemene Rekenkamer gebruik maken van de resultaten van door anderen verrichte controles, onverminderd haar bevoegdheid tot het verrichten van onderzoek.",01-01-2018,jci1.3:c:BWBR0039429&hoofdstuk=7&paragraaf=2&artikel=7.18&lid=3&z=2020-01-01&g=2020-01-01
493,Hoofdstuk7,Paragraaf2,Artikel7.18,Lid4,,,"De Algemene Rekenkamer kan de bevoegdheden, bedoeld in dit artikel, uitoefenen zolang als en over de jaren dat het Rijk daarbij belang heeft.",01-01-2018,jci1.3:c:BWBR0039429&hoofdstuk=7&paragraaf=2&artikel=7.18&lid=4&z=2020-01-01&g=2020-01-01
